Channel_SKU,Master_SKU,SKU_Name,Channel
8806182509728,30100105,"The Face Shop Jeju Aloe Fresh Soothing Gel With , Non Sticky Aloe Gel For Body, Face & Hair (300ML)",Nykaa
8806182519307,30100351,The Face Shop Rice Water Bright Light Cleansing Oil(150ml),Nykaa
8806182519314,30100352,"The Face Shop Rice Water Bright Rich Cleansing Oil, Makeup Remover On Heavy Makeup & Impurities",Nykaa
8806182519369,30100001,The Face Shop Rice Water Bright Lip & Eye Makeup Remover(120ml),Nykaa
8806182525292,30100072,The Face Shop Smile Foot Peeling Mask(40ml),Nykaa
8806182528057,30100244,The Face Shop Jeju Volcanic Lava Aloe Nose Strip - 1Pcs(1Strip),Nykaa
8806182528071,30100246,"The Face Shop Jeju Volcanic Lava Aloe Nose Strip, Nose Patches To Remove Blackheads & Whiteheads",Nykaa
8806182528835,30100107,"The Face Shop Jeju Aloe Fresh Soothing Gel Tube, Pure Non Sticky Aloe Gel For Body, Face & Hair (300 ml)",Nykaa
8806182529269,30100035,"The Face Shop White Seed Serum With Niacinamide &Hyaluronic Acid, Fights Dullness & Blemishes(50 ml)",Nykaa
8806182529399,30100410,"The Face Shop Pomegranate And Collagen Toner, Toner With Collagen & & Hyaluronic Acid(160ml)",Nykaa
8806182529405,30100411,"The Face Shop Pomegranate And Collagen Emulsion, With Collagen & Hyaluronic Acid (140ML)",Nykaa
8806182529412,30100412,"The Face Shop Pomegranate And Collagen Serum, Collagen & Hyaluronic Acid, For Skin Firming (80ml)",Nykaa
8806182529429,30100413,"The Face Shop Pomegranate And Collagen Cream, Day & Night Cream To Boost Collagen & Brighten Skin (100 ml)",Nykaa
8806182529436,30100414,"The Face Shop Pomegranate And Collagen Eye Cream With 10% Collagen, For Under Eye Dark Circles 50ml",Nykaa
8806182531323,30100118,The Face Shop Bio-Cell Moisturizing Face Mask(25g),Nykaa
8806182531392,30100005,The Face Shop The Solution Hydrating Face Mask(20g),Nykaa
8806182531408,30100006,The Face Shop The Solution Moisturizing Face Mask(20g),Nykaa
8806182531415,30100007,The Face Shop The Solution Brightening Face Mask(20g),Nykaa
8806182531439,30100008,The Face Shop The Solution Firming Face Mask(20g),Nykaa
8806182531453,30100009,The Face Shop The Solution Nourishing Face Mask(20g),Nykaa
8806182531477,30100011,The Face Shop The Solution Pore Care Face Mask(20g),Nykaa
8806182535451,30100416,"The Face Shop Rice & Ceramide Moisturizing Toner, Face Toner To Moisturize & Brighten Skin (150ML)",Nykaa
8806182535468,30100417,"The Face Shop Rice & Ceramide Moisturizing Emulsion, Locks Skin Moisture & Strengthens Skin Barrier (150 ml)",Nykaa
8806182535475,30100435,The Face Shop Rice&Ceramide Moisturizing Cream Face Cream To Brighten And Strengthen Skin Barrier(50ml),Nykaa
8806182536502,30100240,The Face Shop The Therapy Hydrating Formula Emulsion(130ml),Nykaa
8806182547676,30100401,The Face Shop Real Nature Green Tea Face Mask(20g),Nykaa
8806182550638,30100418,"The Face Shop Calendula Moisture Toner With Squalene, Fights Acne & Blemishes, For Sensitive Skin",Nykaa
8806182550645,30100419,"The Face Shop Calendula Moisture Lotion With Squalene, Fights Acne & Blemishes, For Sensitive Skin",Nykaa
8806182550652,30100447,"The Face Shop Calendula Moisture Cream With Squalene, Fights Acne & Blemishes, For Sensitive Skin (50ml)",Nykaa
8806182550683,30100250,"The Face Shop Jeju Volcanic Lava Scrub Foam, Exfoliator For Tan Removal, Whiteheads And Blackheads (140ml)",Nykaa
8806182550690,30100251,"The Face Shop Jeju Volcanic Lava Anti Dust Pore Cleansing Foam, Face Wash For Deep Skin Cleansing",Nykaa
8806182550997,30100003,"The Face Shop Rice Water Bright Foaming Cleanser, Face Wash For Glowing Skin &Even Skin Tone (150ML)",Nykaa
8806182552342,30100109,"The Face Shop Fresh Jeju Aloe Refreshing Soothing Ice Gel, Cooling Aloe Gel For Body, Face & Hair",Nykaa
8806182552380,30100112,"The Face Shop Smart Peeling Honey Black Sugar Scrub, Exfoliator For Blackhead, Whitehead & Pollution",Nykaa
8806182557101,30100012,The Face Shop Real Nature Aloe Face Mask(20g)(Aloe),Nykaa
8806182557125,30100014,The Face Shop Real Nature Lemon Face Mask(20g)(Lemon),Nykaa
8806182557132,30100015,The Face Shop Real Nature Rice Face Mask(20g)(Rice),Nykaa
8806182557149,30100016,The Face Shop Real Nature Mung Bean Face Mask(20g)(Mung Bean),Nykaa
8806182557156,30100017,The Face Shop Real Nature Kelp Face Mask(20g)(Kelp),Nykaa
8806182557163,30100018,The Face Shop Real Nature Honey Miel Face Mask(20g)(Honey),Nykaa
8806182557170,30100019,The Face Shop Real Nature Olive Face Mask(20g)(Olive),Nykaa
8806182557187,30100020,The Face Shop Real Nature Avocado Face Mask(20g)(Avocado),Nykaa
8806182557194,30100021,The Face Shop Real Nature Pomegranate Grenade Face Mask(20g)(Pomegranate),Nykaa
8806182557200,30100140,The Face Shop Real Nature Tea Tree Face Mask(20g)(Tea Tree),Nykaa
8806182557217,30100022,The Face Shop Real Nature Blueberry Face Mask(20g)(Blueberry),Nykaa
8806182557224,30100023,The Face Shop Real Nature Shea Butter Face Mask(20g)(Shea Butter),Nykaa
8806182559990,30100025,The Face Shop Real Nature Calendula Face Mask(20g)(Calendula),Nykaa
8806182560002,30100026,The Face Shop Real Nature Green Tea Face Mask(20g)(Green Tea),Nykaa
8806182560019,30100027,The Face Shop Real Nature Lingzhi Face Mask(20g)(Lingzhi),Nykaa
8806182560026,30100028,The Face Shop Real Nature Red Ginseng Face Mask(20g)(Red Ginseng),Nykaa
8806182560033,30100149,The Face Shop Real Nature Bamboo Face Mask(20g)(Bamboo),Nykaa
8806182560040,30100150,The Face Shop Real Nature Potato Face Mask(20g)(Potato),Nykaa
8806182565694,30100420,"The Face Shop Calendula Moisture Serum With Squalene, Fights Acne & Blemishes, For Sensitive Skin",Nykaa
8806182565700,30100421,"The Face Shop Calendula Moisture Eye Cream With Squalene, Calms Irritated Skin, For Sensitive Skin",Nykaa
8806182568138,30100465,The Face Shop Smile Foot Mask(18ml),Nykaa
8806182574122,30100438,"The Face Shop White Seed Brightening Toner With Niacinamide & Vitamin B, For Dullness & Acne Scars (160ml)",Nykaa
8806182574139,30100439,"The Face Shop White Seed Brightening Face Lotion With Niacinamide & Vitamin B, For Even Skin Tone",Nykaa
8806182577406,30100470,"The Face Shop Water Fit Lip Tint - Rose Pink, Waterproof & Long Lasting Lip & Cheek Tint(5gm)",Nykaa
8806182577413,30100471,"The Face Shop Water Fit Lip Tint - Pink Mate, Waterproof & Long Lasting Lip & Cheek Tint 5gm",Nykaa
8806182577420,30100472,"The Face Shop Water Fit Lip Tint - 3 Picnic Red, Waterproof & Long Lasting Lip & Cheek Tint(5gm)",Nykaa
8806182577437,30100473,"The Face Shop Water Fit Lip Tint - Red Signal, Waterproof & Long Lasting Lip & Cheek Tint (5g)",Nykaa
8806182577444,30100474,"The Face Shop Water Fit Lip Tint - Cherry Kiss, Waterproof & Long Lasting Lip & Cheek Tint (5g)",Nykaa
8806182579165,30100456,"The Face Shop Chia Seed Hydro Toner With Vitamin B12 & Chia Seeds, Face Toner For 24Hr Hydration (160 ml)",Nykaa
8806182579172,30100457,"The Face Shop Chia Seed Hydro Lotion With Vitamin B12, Everyday Wear Face Cream For 24Hr Hydration (145ML)",Nykaa
8806182579189,30100458,"The Face Shop Chia Seed Hydro Mist With Vitamin B12 & Chia Seeds, Mist Toner For 24Hr Hydration",Nykaa
8806182579196,30100459,"The Face Shop Chia Seed Hydro Cream With Vitamin B12, 24Hr Intense Hydration Face Moisturizer (50ML)",Nykaa
8806182582103,30100520,The Face Shop Dr.Belmeur Clean Face Mild Toner With 2% Niacinamide (145ml),Nykaa
8806182582110,30100521,The Face Shop Dr.Belmeur Clean Face Mild Lotion With Squalane(145ml),Nykaa
8806364010653,30100511,"The Face Shop Herb Day 365 Face Wash - Aloe & Greentea, Hydrates Skin & Maintains Ph Level(170ml)",Nykaa
8806364010660,30100510,"The Face Shop Herb Day 365 Face Wash- Lemon & Grapefruit, Face Wash With Vitamin C & Glycolic Acid (170ml)	",Nykaa
8888820200924,TFSCOM00254,The Face Shop X Corallista - Ankita’s Glow Getter’s Kit(5 pieces),Nykaa
NYFRETHFS0051,30100160,Free The Face Shop White Seed Brightening Discovery Kit(74ml),Nykaa
NYFRETHFS0074,30100297,Free The Face Shop Chia Seed Lotion 32ml(32ml),Nykaa
NYFRETHFS0075,30100298,Free The Face Shop Chia Seed Hydrating Toner 32ml(32ml),Nykaa
NYFRETHFS0078,30100335,Free The Face Shop Chia Seed Hydrating Trio Kit(74ml),Nykaa
NYFRETHFS0082,TFSFREE00001,Free The Face Shop Gwp Pouches - Assorted(),Nykaa
NYFRETHFS0088,TFSFREE00056,Free The Face Shop White Seed Brightening Serum With 2% Niacinamide (10Ml)(10ml),Nykaa
NYFRETHFS0096,30100367,Free The Face Shop Rice Water Bright Foaming Cleanser(50ml),Nykaa
NYFRETHFS0130,30100443,Free The Face Shop Rice Water Bright Foaming Cleanser 100ml(100ml),Nykaa
NYFRETHFS0147,30100513,Free The Face Shop Chia Seed Hydrating Travel Kit(74ml),Nykaa
NYFRETHFS0148,TFSFREE00042,Free The Face Shop X AA Living : Plus Bath Mats(1 pcs),Nykaa
NYFRETHFS0151,30100514,Free The Face Shop Green Natural Seed Antioxidant Trio Kit(74ml),Nykaa
THEFA00000011,30100529,"The Face Shop Rice & Ceramide Moisturizing Skincare Set, Complete Travel Friendly Skincare Routine (78 ml)",Nykaa
THEFA00000012,30100523,The Face Shop Naturalsun Eco Super Active Sun Cream Spf 50+ Sun Protection For Outdoor Sports (50ML),Nykaa
THEFA00000014,30100525,"The Face Shop Naturalsun Eco Super Perfect Sunscreen Spf 50+, Sun Protection For Indoor Activities (45 ml)",Nykaa
THEFA00000015,30100526,The Face Shop Naturalsun Eco Sunscreen Primer Spf 50+ Pa++++ With 2% Zinc Oxide & Squalane(50ml),Nykaa
THEFA00000016,30100527,"The Face Shop Naturalsun Eco Mattifying Sun Compact Spf 30, Pa ++, Full Coverage Compact",Nykaa
THEFA00000017,30100528,"The Face Shop Naturalsun Eco Hydrating Sunscreen Spf 50+, Broad Spectrum Protection & No White Cast (50 ml)",Nykaa
THEFA00000018,30100003,Free The Face Shop Rice Water Bright Cleansing Foam(150ml),Nykaa
THEFA00000019,30100529,Free The Face Shop Rice & Ceramide Moisturizing Skincare Set(78ml),Nykaa
THEFA00000021,TFSCOM00312,The Face Shop Get Set Glow Kit(4 pieces),Nykaa
THEFA00000022,TFSCOM00313,The Face Shop Glow Key Pro When It Comes To Glow Combo(7 pieces),Nykaa
THEFA00000023,TFSCOM00314,The Face Shop Glow Key Ready To Shine Like Gloss Combo(7 pieces),Nykaa
THEFA00000033,TFSCOM00327,The Face Shop Hustle & Glow Kit(4Pcs),Nykaa
THEFA00000034,30100536,The Face Shop Yehwadam Silky Smooth Body Peeling Gel(300ml),Nykaa
THEFA00000036,30100538,The Face Shop Dr.Belmeur Amino Clear Cleansing Foaming Cleanser(150ml),Nykaa
THEFA00000037,30100539,"The Face Shop Dr.Belmeur Clarifying Acne Patches, Reduces Acne Sizes & Prevents Acne From Scarring (72 Paches)",Nykaa
THEFA00000039,30100541,The Face Shop Dr.Belmeur Clarifying Ultra Soothing Patches(6 pieces),Nykaa
THEFA00000040,30100543,The Face Shop Jeju Aloe Fresh Soothing Foam Cleanser Gel  Foam Hydrating & Cooling Face Wash(150ml),Nykaa
THEFA00000043,30100546,The Face Shop Jeju Volcanic Lava 3 Step Impurity Removing Nose Strip Kit(3 pieces),Nykaa
THEFA00000045,30100548,The Face Shop Real Nature Charcoal Face Mask(20ml)(Charcoal) (20ML),Nykaa
THEFA00000046,30100531,The Face Shop Fmgt Designing Eyebrow Pencil - Light Brown(0.3 g)(Light Brown),Nykaa
THEFA00000047,30100534,The Face Shop Fmgt Designing Eyebrow Pencil - Brown(0.3 g)(Brown),Nykaa
THEFA00000048,30100535,The Face Shop Fmgt Designing Eyebrow Pencil - Dark Brown(0.3 g)(Dark Brown),Nykaa
THEFA00000065,30100435,Free The Face Shop Rice & Ceramide Moisturizing Cream(50ml),Nykaa
THEFA00000067,30100352,Free The Face Shop Rice Water Bright Rich Cleansing Oil(150ml),Nykaa
THEFA00000068,30100111,Free The Face Shop Smart Peeling White Jewel(120ml),Nykaa
THEFA00000082,30100555,Free The Face Shop Pomegranate & Collagen Duo Kit(64ml),Nykaa
THEFA00000083,30100554,"The Face Shop Rice Water Bright Foaming Cleanser, Face Wash For Glowing Skin & Even Skin Tone(100ml)",Nykaa
THEFA00000103,TFSFREE00127,Free The Face Shop Style 1 Pink Pouch - Full Covered(100 g),Nykaa
THEFA00000104,TFSFREE00128,Free The Face Shop Style 2 Pink Pouch - Half Transparent(100 g),Nykaa
THEFA00000105,THEFA00000105,The Face Shop Wedding Favour Combo(7 pcs),Nykaa
THEFA00000107,THEFA00000107,The Face Shop Honeymoon Combo(2 pcs),Nykaa
THEFA00000108,TFSFREE0044,Free The Face Shop Lipstick Case(1 pcs),Nykaa
THEFA00000112,TFSCOM00364,"The Face Shop Rice Water Bright Foaming Cleanser, Face Wash For Glowing Skin & Even Skin Tone (2pc) combo (50 ml)",Nykaa
THEFA00000116,20100001,Free The Face Shop Double Duty Cleanser(100ml),Nykaa
THEFA00000117,20100003,Free The Face Shop Go-To-Bed Sleeping Mask(50 g),Nykaa
THEFA00000119,TFSMCH000008,Free The Face Shop Pink Velvet Sling(1 pcs),Nykaa
THEFA00000120,TFSMCH000009,Free The Face Shop Rice Husk Sippy Cup(1 pcs),Nykaa
THEFA00000121,TFSCOM00364,The Face Shop Rice Water Bright Foaming Cleanser Combo(50ml),Nykaa
THEFA00000123,30100574,"The Face Shop Tea Tree Pore Gel Cleanser With Ip- Bha, Pha & Hyaluronic Acid, Gel To Foam Face Wash",Nykaa
THEFA00000124,30100560,"The Face Shop Tea Tree Toner Pads (Sheets) With Ip- Bha, Pha & Hyaluronic Acid, For Acne & Oily Skin",Nykaa
THEFA00000125,30100561,"The Face Shop Tea Tree Pore Ampoule With Ip- Bha, Pha & Hyaluronic Acid, For Oily & Acne Prone Skin",Nykaa
THEFA00000126,30100562,"The Face Shop Tea Tree Pore Cream With Ip- Bha, Pha & Hyaluronic Acid, For Oily & Acne Prone Skin (50ml)",Nykaa
THEFA00000127,30100563,"The Face Shop The Therapy Vegan Moisture Blending Cream With Niacinamide, Gives 48Hr Hydration",Nykaa
THEFA00000128,30100557,"The Face Shop The Therapy Vegan Blending Cream, Organic & Vegan 2 In 1 Gel & Cream With Niacinamide",Nykaa
THEFA00000129,30100558,"The Face Shop The Therapy Vegan Blending Toner, Organic & Vegan Toner To Smooth Wrinkles(180ml)",Nykaa
THEFA00000130,30100571,"The Face Shop The Therapy Vegan Sunscreen Stick Spf50+ Pa++++, Travel Friendly Everyday Use Sunstick",Nykaa
THEFA00000131,30100569,The Face Shop The Face Shop The Therapy Vegan Moisturizing Serum Sunscreen Spf 50+ Pa++++ (50ML),Nykaa
THEFA00000133,30100573,The Face Shop Dr.Belmeur Derma Collagen Hydrogel Eye Patches For Under Eye Dark Cicle &Wrinkles(4gm),Nykaa
THEFA00000135,30100572,The Face Shop Power Long-Lasting Spf 50+ Pa+++ Tinted Suncream For Broad Spectrum Protection(50 ML),Nykaa
THEFA00000136,30100564,The Face Shop The Face Shop Vegan Hand Cream - Sunrise Bedroom With Hyaluronic Acid(30ml),Nykaa
THEFA00000137,30100565,The Face Shop The Face Shop Non-Greasy Vegan Hand Cream - Morning Florist With Hyaluronic Acid(30ml),Nykaa
THEFA00000138,30100566,The Face Shop The Face Shop Non-Greasy Vegan Hand Cream - Noon Park With Hyaluronic Acid(30ml),Nykaa
THEFA00000139,30100567,The Face Shop The Face Shop Non-Greasy Vegan Hand Cream - Sunset Rooftop With Hyaluronic Acid (30ml),Nykaa
THEFA00000140,30100568,The Face Shop The Face Shop Vegan Hand Cream - Midnight Street With Hyaluronic Acid(30ml),Nykaa
THEFA00000141,30100576,"The Face Shop The Face Shop All Clear Micellar All-In-One Face Wash With Hyaluronic Acid, Aha & Pha(150ml)",Nykaa
THEFA00000142,30100577,Free The Face Shop The Therapy Vegan Trial Kit(62ml),Nykaa
THEFA00000152,30100577,"The Face Shop The Therapy Vegan Skincare Kit, Limited Edition Luxury Skin Routine Gift Set (62 ML)",Nykaa
THEFA00000153,30100580,The Face Shop Rice Water Bright Trial Kit,Nykaa
SIXAM00000001,20100001,SIXAM Glow Double Duty Cleanser(100ml),Nykaa
SIXAM00000003,20100002,SIXAM Glow Alt. Command. Slay. Exfoliator(115 g),Nykaa
SIXAM00000004,GLWCOM000001,SIXAM Glow Get.Set.Glow Starter Kit(300 g),Nykaa
SIXAM00000006,20100003,SIXAM Glow Go-To-Bed Sleeping Mask(50 g),Nykaa
SIXAM00000007,20100006,SIXAM Glow Pivot The Pores Exfoliator(100ml),Nykaa
SIXAM00000008,20100007,SIXAM Glow Chief Glow Officer Serum-N-Cream With SPF 20 PA ++++(30ml),Nykaa
SIXAM00000009,20100008,SIXAM Glow Chief Glow Officer Serum-N-Cream (Mini)(15ml),Nykaa
SIXAM00000010,20100005,SIXAM Glow Double Duty Cleanser (Mini)(21ml),Nykaa
SIXAM00000011,20100004,SIXAM Glow Go-To-Bed Sleeping Mask (Mini)(15ml),Nykaa
SIXAM00000012,20100008,Free SIXAM Glow Chief Glow Officer Serum-N-Cream (Mini)(15ml),Nykaa
SIXAM00000013,20100005,Free SIXAM Glow Double Duty Cleanser (Mini)(21ml),Nykaa
SIXAM00000014,20100004,Free SIXAM Glow Go-To-Bed Sleeping Mask (Mini)(15ml),Nykaa
SIXAM00000015,20100009,SIXAM Glow Win Win Face Serum + Oil(50ml),Nykaa
DHCBE00000001,70100001,DHC Beauty Deep Cleansing Oil(30ml),Nykaa
DHCBE00000006,70100006,DHC Beauty Lip Cream(1.5 g),Nykaa
DHCBE00000022,70100004,Free DHC Beauty Face Wash Powder(15 g),Nykaa
DHCBE00000026,DHCCOM00002,Free DHC Beauty Try Before You Buy(4 pieces),Nykaa
DHCBE00000033,DHCFREE0001,Free DHC Beauty Deep Cleansing Oil Sachet(3ml),Nykaa
DHCBE00000034,DHCFREE0002,Free DHC Beauty Face Wash Powder Sachet(1 g),Nykaa
DHCBE00000037,70100012,DHC Beauty Vitamin C Essence(25ml),Nykaa
DHCBE00000038,70100013,DHC Beauty Pore Lotion(120ml),Nykaa
DHCBE00000039,70100014,DHC Beauty Facial Scrub(100 g),Nykaa
DHCBE00000040,70100015,DHC Beauty Revitalizing Moisture Strips Eyes(6 pcs),Nykaa
DHCBE00000042,70100017,DHC Beauty Pore Face Wash(120 g),Nykaa
DHCBE00000043,70100018,DHC Beauty Medicated Skin Conditioner Face Wash(100 g),Nykaa
DHCBE00000044,70100019,DHC Beauty Mineral Face Wash(100 g),Nykaa
DHCBE00000045,70100020,DHC Beauty Mild Foaming Face Wash(100 g),Nykaa
DHCBE00000046,70100005,Free DHC Beauty Face Wash Powder(50 g),Nykaa
DHCBE00000051,70100022,DHC Beauty LX-ME Brightening Lotion(180ml),Nykaa
DHCBE00000053,70100024,DHC Beauty LX-ME Brightening Gel(120gm),Nykaa
DHCBE00000056,70100021,Free DHC Beauty Pore Cleansing Oil(2ml),Nykaa
DHCBE00000057,70100025,Free DHC Beauty Mineral Face Wash Sachet(3ml),Nykaa
DHCBE00000058,70100026,Free DHC Beauty Mild Foaming Face Wash Sachet(3ml),Nykaa
8801051666823,60100008,"Belif The True Cream Moisturizing Bomb, Clinically Proven To Retain Moisture For 26H, Dermat Tested",Nykaa
8801051692914,60100038,"Belif Problem Solution Moisturizer With Tea Tree, Dermat Tested Face Cream For Oily & Sensitive Skin",Nykaa
8801051743180,60100016,belif The True Cream Water Bomb(75ml),Nykaa
8801051781991,60100029,"Belif Hungarian Water Serum, Dermat Tested Light Weight Face Serum, Increases Skin Hydration By 20%",Nykaa
8801051782400,60100009,"Belif The True Cream Aqua Bomb, Dermat Tested Moisturizer, Increases Skin Hydration By 70%",Nykaa
8801051793833,60100010,"Belif The True Cream Moisturizing Bomb, Clinically Proven To Retain Moisture For 26H, Dermat Tested",Nykaa
8801051926484,60100015,belif Skin Regeneration Sleeping Mask(50ml),Nykaa
8801051930962,60100022,"Belif Problem Solution Toner With Tea Tree, Dermat Tested Toner For Oily & Sensitive Skin",Nykaa
8801051959253,60100041,"Belif Peat Miracle Eye Cream With Collagen To Reduce Under Wrinkles & Dark Circles, Dermat Tested",Nykaa
8801051991741,TFSCOM00153,belif Travel Kit,Nykaa
BELIF00000002,TFSCOM00310,belif Hydration Mania Kit(5 pieces),Nykaa
BELIF00000003,TFSCOM00311,Free belif Bestseller Kit(4 pieces),Nykaa
BELIF00000017,60100008,Free belif The True Cream Aqua Bomb(25ml),Nykaa
BELIF00000018,60100013,Free belif Numero 10 Essence(50ml),Nykaa
BELIF00000019,60100067,"Belif UV Protector Multi Face Sunscreen SPF50+ PA++++, Dermatologically Tested(50ml)",Nykaa
BELIF00000020,60100066,Free belif True Cream Aqua Bomb(3ml),Nykaa
BELIF00000021,60100054,Free belif True Cream Moisturizing Bomb(3ml),Nykaa
BELIF00000023,60100069,Free belif Uv Protector Multi Sunscreen +(3ml),Nykaa
BELIF00000024,60100070,Free belif Aqua Bomb Jelly Cleanser(3ml),Nykaa
BELIF00000025,60100068,Free belif Creamy Cleansing Foam(3ml),Nykaa
BELIF00000027,BLFCOM00004,"Belif Travel Kit 2.0, Travel Friendly Minis, Ultimate Skin Hydrator Kit",Nykaa
BELIF00000033,BLFCOM00004,Free belif Travel Kit 2.0(79ml),Nykaa
BELIF00000034,BLFCOM00006,belif Ready Set Glow Combo(10ml),Nykaa
BELIF00000035,BLFCOM00005,belif Ready Set Hydrate Combo(10ml),Nykaa
BELIF00000036,BLFCOM00007,belif Glow On The Go Combo(19ml),Nykaa
BELIF00000037,BLFCOM00008,belif The Glow Duo(19ml),Nykaa
BELIF00000039,BLFCOM00010,belif Oily Skin Bff Duo(20ml),Nykaa
BELIF00000040,BLFCOM00011,belif Dry Skin Bff Duo(20ml),Nykaa
NYKFREBLF0001,60100004,Free belif Milky Moisturizer Hydra Balancing (20ml),Nykaa
NYKFREBLF0002,60100011,Free belif Bergamot Herbal Extract Toner (20ml),Nykaa
NYKFREBLF0003,60100003,Free belif Creamy Cleansing Foam (30ml),Nykaa
NYKFREBLF0004,60100001,Free belif The True Cream Aqua Bomb (10ml),Nykaa
NYKFREBLF0005,60100002,Free belif The True Cream Moisturizing Bomb (10ml),Nykaa
NYKFREBLF0007,60100006,Free belif Numero 10 Essence (10ml),Nykaa
NYKFREBLF0009,TFSCOM00259,Free belif Travel Kit 80ml(80ml),Nykaa
8806182521591,30100463, Perfume Seed Rose Body Mist,Nykaa
8806182549175,30100086, Perfume Seed Capsule Body Wash,Nykaa
8806182535048,30100079, Milk & Shea Butter Oil Infused Body Lotion,Nykaa
8806182535055,30100080, Milk & Shea Butter Creamy Body Wash,Nykaa
8806182582240,30100493, Club Ryan Avocado Body Wash,Nykaa
8806182582257,30100494, Club Ryan Avocado Body Lotion,Nykaa
8806182527296,30100078, Avocado Body Lotion,Nykaa
8806182575259,30100451, All Over Perfumed Mist Baby Musk,Nykaa
BELIF00000008,60100062,belif aqua bomb Jelly cleanser _160ml,Nykaa
8806182549199,30100085,Raspberry Body Wash,Nykaa
8806182527272,30100077,Raspberry Body Lotion,Nykaa
8806182549182,30100084,Grapefruit Body Wash,Nykaa
8806182549168,30100083,Avocado Body Wash,Nykaa
8806182532665,30100108,Jeju Fresh Lotus Soothing Gel,Nykaa
8806182513275,30100106,Damyang Bamboo Fresh Soothing Gel,Nykaa
8806182565779,30100241,The Therapy Anti Aging Eye Cream,Nykaa
8806182579233,30100481, Mango Seed Moisturizing Eye Cream,Nykaa
8806182520327,30100355,Mango Seed Silk Moisturing Eye Cream,Nykaa
8806182520044,30100353, Mango Seed Cleansing Foam,Nykaa
8806182583667,30100496, Herb Day 365 Master Blending Foam Cleanser Special Set,Nykaa
8806364010684,30100508, Herb Day 365 Cleansing Foam Peach,Nykaa
8806364010646,30100512, Herb Day 365 Master Blending Foaming Cleanser - Mungbean & Mugwort ,Nykaa
8806182565649,30100061, All Clear All In One Foaming Cleanser,Nykaa
8806364010677,30100509, Herb Day 365 Acerola Cleansing Foam,Nykaa
8806364018406,30100049,Herb Day 365 Cleansing Foam Spearmint,Nykaa
THEFA00000134,30100575,Mango Seed Creamy Foaming Cleanser,Nykaa
8806182551819,30100100, Essential Damage Care Hair Serum,Nykaa
8806182551826,30100101, Essential Damage Care Hair Oil Serum,Nykaa
8806182551802,30100099, Essential Damage Care Dual Deep Treatment Pack,Nykaa
8806182561450,30100440, Dr.Schwarz Shampoo For Damaged Hair,Nykaa
8806182561467,30100441, Dr.Schwarz Hair Treatment,Nykaa
8806182575563,30100464, Rich Hand V Special Care Hand Mask,Nykaa
8806182577369,30100453, My Plant Hand Cream - Good Luck,Nykaa
8806182577376,30100454, My Plant Hand Cream - Good Job,Nykaa
8806182577383,30100455, My Plant Hand Cream - Good Day,Nykaa
8806364050260,30100154, Lovely Meex Mini Pet Hand Cream 03 White Floral,Nykaa
8806364053964,30100155, Lovely Meex  Mini Pet Hand Cream 04 Fruity Floral,Nykaa
8806182582691,30100497, Holiday Special Hand Cream Set,Nykaa
8806182563539,30100408, Daily Perfumed Hand Lotion Orchid,Nykaa
8806182576843,30100467, Daily Perfume Hand Cream Real Peach,Nykaa
8806182576836,30100466, Daily Perfume Hand Cream Grapefruit,Nykaa
8806182576850,30100468, Daily Perfume Hand Cream Avocado,Nykaa
8806182526527,30100067, Daily Perfume Hand Cream 06 Cherry Blossom,Nykaa
8806182526510,30100066, Daily Perfume Hand Cream 05 Green Tea,Nykaa
8806182526473,30100062, Daily Perfume Hand Cream 01 Rose Water,Nykaa
8806364050246,30100153,Lovely Meex Mini Pet Hand Cream 01 Baby Powder,Nykaa
8888823082019,TFSCOM00174,The Faceshop x DearPacker Go For The Glow KitÂ - White Water Peeling Pack,Nykaa
8888827082019,TFSCOM00178,The Faceshop x DearPacker Go For The Glow KitÂ - Moisture Mascream,Nykaa
8888825082019,TFSCOM00176,The Faceshop x DearPacker Go For The Glow KitÂ - Madagascar Clay Mask,Nykaa
8888824082019,TFSCOM00175,The Faceshop x DearPacker Go For The Glow KitÂ - Black Tea & Black Rose Mask,Nykaa
8888826082019,TFSCOM00177,The Faceshop x DearPacker Go For The Glow KitÂ - Black Ginseng Gold Mask,Nykaa
8806182526565,30100070,Daily Perfume Hand Cream Snowcotton,Nykaa
8806182526497,30100064,Daily Perfume Hand Cream Applepop,Nykaa
8806182526541,30100069,Daily Perfume Hand Cream 08 Acaciahoney,Nykaa
8806182526534,30100068,Daily Perfume Hand Cream 07 Macadamia,Nykaa
8806182526503,30100065,Daily Perfume Hand Cream 04 Berry Mix,Nykaa
8806182526480,30100063,Daily Perfume Hand Cream 02 Tiare,Nykaa
8888811012019,TFSCOM00131,The Face Shop Valentines Day Pouch(300gm),Nykaa
8806182583643,30100499, Yehwadam Revitalizing Travel Kit,Nykaa
8806182583650,30100500, Yehwadam Pure Brightening Travel Kit,Nykaa
THEFA00000002,TFSCOM00262, X Sukhneet: Glow Vibes Only Kit,Nykaa
THEFA00000080,TFSCOM00342, X Shreya Jain Ke Saare Must Haves Ka Kit,Nykaa
8888802112020,TFSCOM00260, X Debasree : You Dew You Kit,Nykaa
8888817072019,TFSCOM00166, Working Women Kit 9 Units,Nykaa
THEFA00000084,TFSCOM00344, ValentineS Day Kit_2022,Nykaa
THEFA00000009,TFSCOM00273, Valentines Day Kit,Nykaa
8888816012020,TFSCOM00247, Valentines Day Kit 2020,Nykaa
8888820190928,TFSCOM00235, Troubled Skincare Kit,Nykaa
8888810052019,TFSCOM00154, Travel Kit,Nykaa
8888820190920,TFSCOM00227, The Og Glow Kit,Nykaa
THEFA00000073,TFSCOM00334, Thanksgiving Kit,Nykaa
8888817052019,TFSCOM00163, Skincare Starter Kit,Nykaa
THEFA00000003,TFSCOM00272, Skincare Obsession Kit,Nykaa
THEFA00000071,TFSCOM00331, Shine Like A Star Gift Box,Nykaa
THEFA00000070,TFSCOM00330, Secret To Glow Gift Box,Nykaa
8888820190921,TFSCOM00228, Perfect Skin Kit,Nykaa
THEFA00000052,TFSCOM00329, P.S. I Love Skincare Kit,Nykaa
8888820190926,TFSCOM00233, Lip Squared Combo,Nykaa
8888820190925,TFSCOM00232, Its Time To Glow Kit,Nykaa
THEFA00000088,TFSCOM00347, Hydrating Expert Kit,Nykaa
8888820190922,TFSCOM00229, Good Mood Skin Kit,Nykaa
THEFA00000051,TFSCOM00328, Glow Goals Kit,Nykaa
8888820190923,TFSCOM00230, Getback To Glow Kit,Nykaa
8888820190924,TFSCOM00231, Get Your Glow On Kit,Nykaa
8806182586088,30100501, Dr.Belmeur Advanced Cica Travel Kit,Nykaa
8806182582264,30100495, Club Ryan Body Care Travel Kit,Nykaa
8888820190927,TFSCOM00234, Cleansing Cube Kit,Nykaa
