Channel_SKU,Master_SKU,SKU_Name,Channel
10124531,BLFCOM00002, Hot Girl Glow Kit,Blinkit
10135439,30100150, Real Nature Potato Face Mask(20gm)(Potato),Blinkit
10124280,30100416, Rice & Ceramide Moisturizing Toner,Blinkit
10124407,30100417, Rice & Ceramide Moisturizing Emulsion,Blinkit
10135437,30100028, Real Nature Red Ginseng Face Mask(20gm)(Red Ginseng),Blinkit
10135436,30100022, Real Nature Blueberry Face Mask(20gm)(Blueberry),Blinkit
10124295,30100540,Dr.Belmeur Clarifying After Spot Cover Patches,Blinkit
10135442,30100021, Real Nature Pomegranate Face Mask(20gm)(Pomegranate),Blinkit
10135440,30100026, Real Nature Green Tea Face Mask(20gm)(Green Tea),Blinkit
10124405,30100554,Rice Water Bright Foaming Cleanser 100Ml,Blinkit
10135448,30100012, Real Nature Aloe Face Mask(20gm)(Aloe),Blinkit
10124298,30100547,Jeju Volcanic Lava Impurity Removing Nose Pack,Blinkit
10135447,30100008, The Solution Firming Face Mask(20gm),Blinkit
10124396,60100052, the true cream moisturizing bomb 25ml,Blinkit
10124402,TFSCOM00304,Real Nature Glowing Bride Masksheet Combo (Pack of 10),Blinkit
10124406,30100435, Rice & Ceramide Moisturizing Cream,Blinkit
10135438,30100548,Real Nature Charcoal Face Mask,Blinkit
10124533,BLFCOM00006," Ready, Set, Glow Combo",Blinkit
10135441,30100020, Real Nature Avocado Face Mask(20gm)(Avocado),Blinkit
10124536,BLFCOM00008, The Glow Duo,Blinkit
10135449,30100014, Real Nature Lemon Face Mask(20gm)(Lemon),Blinkit
10124292,30100529,Rice&Ceramide Moisturizing Skincare Set,Blinkit
10124273,30100003, Rice Water Bright Foaming Cleanser,Blinkit
10124538,BLFCOM00010, Oily Skin BFF Duo,Blinkit
10124535,BLFCOM00007, Glow On The Go Combo,Blinkit
10124294,30100539,Dr.Belmeur Clarifying Spot Soothing Patches,Blinkit
10124296,30100541,Dr.Belmeur Clarifying Ultra Soothing Patches,Blinkit
10135450,30100015, Real Nature Rice Face Mask(20gm)(Rice),Blinkit
10124282,30100470, Water Fit Lip Tint - Rose Pink,Blinkit
10135644,TFSCOM00364,Glow Starter Kit,Blinkit
10124537,BLFCOM00009, Moisture Explosion Set ,Blinkit
10124400,30100512, Herb Day 365 Master Blending Foaming Cleanser - Mungbean & Mugwort ,Blinkit
10124286,30100474, Water Fit Lip Tint - Cherry Kiss,Blinkit
10124275,30100105, Jeju Aloe Fresh Soothing Gel,Blinkit
10124297,30100544,Jeju Volcanic Lava Fresh Nose Strips,Blinkit
10124287,30100251, Jeju Volcanic Lava Cleansing Foam,Blinkit
10135443,30100018, Real Nature Honey Miel Face Mask(20gm)(Honey),Blinkit
10124395,60100008, The True Cream Aqua Bomb 25Ml,Blinkit
10124293,30100510, Herb Day 365 Cleansing Foam Lemon,Blinkit
10124539,BLFCOM00011, Dry Skin BFF Duo,Blinkit
10124278,30100250, Jeju Volcanic Lava Scrub Foam,Blinkit
10124285,30100473, Water Fit Lip Tint - Red Signal,Blinkit
10124404,30100543,Jeju Aloe Fresh Soothing Foam Cleanser,Blinkit
10124276,30100111, Smart Peeling White Jewel Perle,Blinkit
10124403,30100352,Rice Water Bright Rich Cleansing Oil,Blinkit
10124399,30100511, Herb Day 365 Cleansing Foam Aloe,Blinkit
10124284,30100472, Water Fit Lip Tint - Picnic Red,Blinkit
10124283,30100471, Water Fit Lip Tint - Pink Mate,Blinkit
10124534,BLFCOM00005," Ready, Set, Hydrate Combo ",Blinkit
10124281,30100459, Chia Seed Hydro Cream,Blinkit
10124420,30100413, Pomegranate And Collagen Volume Lifting Cream,Blinkit
10124279,30100351, Rice Water Bright Light Cleansing Oil,Blinkit
10124398,60100013, Numero 10 Essence 50Ml,Blinkit
10124401,60100067, UV Protector multi sun screen_50ml,Blinkit
10124582,TFSCOM00268, Unisex Instant Moisturizing Masksheet Combo (Pack of 10),Blinkit
10124274,30100035, White Seed Brightening Serum,Blinkit
10124532,BLFCOM00004, Travel Kit 2.0,Blinkit
10124288,30100509, Herb Day 365 Acerola Cleansing Foam,Blinkit
10124408,60100062, aqua bomb Jelly cleanser _160ml,Blinkit
10124291,30100528, Naturalsun Eco No Shine Hydrating Sun Cream,Blinkit
10124277,30100112, Smart Peeling Honey Black Sugar Scrub,Blinkit
10124397,30100546,Jeju Volcanic Lava 3 Step Impurity Removing Nose Strip Kit,Blinkit
10124289,30100523, Naturalsun Eco Super Active Sun Cream,Blinkit
10140594,10100001,The Better Flour Classic Flour Gluten Atta (500gm),Blinkit
10150029,10100016,"The Better Flour Instant Vegan Chilla or Omelette Mix, Instant Gluten Free & Protein Rich Chilla, Has Plant Based Proteins (200gm)",Blinkit
10140595,10100003,The Better Flour Spinach Flour Gluten Atta (500gm),Blinkit
10150027,10100020,Strawberry Pancake Mix 200g,Blinkit
10140593,10100005,The Better Flour Beetroot Flour Gluten Atta (500gm),Blinkit
10150028,10100018,Instant Beetroot Dosa Mix 200 gms,Blinkit
10139260,70100003,DHC Beauty Deep Cleansing Oil,Blinkit
10139258,70100001,DHC Beauty Deep Cleansing Oil(30ml),Blinkit
10139257,70100002,DHC Beauty Deep Cleansing Oil(70ml),Blinkit
10139256,70100004,DHC Beauty Face Wash Powder(15 g),Blinkit
10139255,70100005,DHC Beauty Face Wash Powder(50 g),Blinkit
10139254,70100006,DHC Beauty Lip Cream(1.5 g),Blinkit
10139265,70100014,DHC Facial Scrub 100gm,Blinkit
10139259,70100018,DHC Medicated Skin Conditioner Face Wash 100gm,Blinkit
10139261,70100020,DHC Mild Foaming Face Wash 100gm,Blinkit
10139262,70100019,DHC Mineral Face Wash 100gm,Blinkit
10139266,70100016,DHC Pore Cleansing Oil 150ml,Blinkit
10139263,70100017,DHC Pore Face Wash 120gm,Blinkit
10139268,70100013,DHC Pore Lotion 120ml,Blinkit
10139264,70100015,DHC Revitalizing Moisture Strips:Eyes (2 Sheets× 6 Pouches),Blinkit
10139267,70100012,DHC Vitamin C Essence 25ml,Blinkit
10139253,DHCCOM00001,DHC Beauty The Japanese Double Cleanse Minis Box,Blinkit
10124290,30100524, Naturalsun Eco Super Aqua Sun Cream,Blinkit
10156228,10100025,Emmer Wheat Penne Pasta (300gm),Blinkit
10156219,10100010,"The Better Flour Emmer Flour Fibre Forward Blend, Khapli Wheat (500 gm)",Blinkit
10156222,10100014,The Better Flour Chocolate Pancake Mix (150gm),Blinkit
10160513,30100371,Rice Water Bright Light Cleansing Oil 55ml,Blinkit
10160540,30100589, Chia Seed Hydro Cream(25ml),Blinkit
10160541,30100588, White Seed Brightening Lotion (50ml),Blinkit
10160890,30100586,Rice & Ceramide Moisturizing Emulsion 70ml,Blinkit
10169098,30100597,The Face Shop Vitamin C Lip Sleeping Mask 14 g - Rs 1295,Blinkit
10169192,30100591,The Face Shop Pomegranate & Collagen Volume Lifting Face Serum(Bottle) 30 ml - Rs 990,Blinkit
10169196,30100576,The Face Shop All Clear Micellar All In One Foaming Face Wash(Tube) 150 ml - Rs 1199,Blinkit
10169199,30100580,The Face Shop Rice Water Bright Kit (Face Wash 100ml + Light Cleansing Oil 55ml),Blinkit
7588976,TFSFREE00012,Yoga For Your Skin Pouch,Myntra
10558968,30100463, Perfume Seed Rose Body Mist,Myntra
7249647,30100086, Perfume Seed Capsule Body Wash,Myntra
12361028,30100444,YEHWADAM REVITALIZING SKINCARE KIT,Myntra
8810841,30100369,Yehwadam Revitalizing Serum 10ml,Myntra
7249624,30100079, Milk & Shea Butter Oil Infused Body Lotion,Myntra
7249644,30100080, Milk & Shea Butter Creamy Body Wash,Myntra
11128144,30100493, Club Ryan Avocado Body Wash,Myntra
11128142,30100494, Club Ryan Avocado Body Lotion,Myntra
7249639,30100078, Avocado Body Lotion,Myntra
10558946,30100451, All Over Perfumed Mist Baby Musk,Myntra
14793048,60100062,belif aqua bomb Jelly cleanser _160ml,Myntra
8501923,30100339,Sweet Apeach Cherry Blossom Body Wash,Myntra
7249634,30100085,Raspberry Body Wash,Myntra
7249617,30100077,Raspberry Body Lotion,Myntra
8059711,30100088,Perfume Seed White Peony Body Wash,Myntra
8059713,30100076,Perfume Seed White Peony Body Milk,Myntra
7249635,30100074,Perfume Seed Velvet Body Milk,Myntra
7249636,30100087,Perfume Seed Rich Creamy Shower Gel,Myntra
7249631,30100073,Perfume Seed Rich Body Milk,Myntra
7249621,30100084,Grapefruit Body Wash,Myntra
7249630,30100090,Grapefruit Body Emulsion,Myntra
7249629,30100083,Avocado Body Wash,Myntra
10558978,30100469,All Over Perfumed Mist 01 Secret Bloom,Myntra
15111872,30100536,Yehwadam Silky Smooth Body Peeling Gel,Myntra
2505913,30100105, Jeju Aloe Fresh Soothing Gel,Myntra
4320617,30100107, Jeju Aloe Fresh Soothing Gel Tube,Myntra
7988023,30100109, Fresh Jeju Aloe Refreshing Soothing Ice Gel,Myntra
2501045,30100108,Jeju Fresh Lotus Soothing Gel,Myntra
2613766,30100106,Damyang Bamboo Fresh Soothing Gel,Myntra
7370684,30100241,The Therapy Anti Aging Eye Cream,Myntra
9113697,30100414, Pomegranate And Collagen Volume Lifting Eye Cream,Myntra
10875064,30100481, Mango Seed Moisturizing Eye Cream,Myntra
9113687,30100421, Calendula Essential Moisture Eye Cream,Myntra
8350579,30100355,Mango Seed Silk Moisturing Eye Cream,Myntra
8351351,30100353, Mango Seed Cleansing Foam,Myntra
2484931,30100003, Rice Water Bright Foaming Cleanser,Myntra
11378372,30100496, Herb Day 365 Master Blending Foam Cleanser Special Set,Myntra
12644884,30100508, Herb Day 365 Cleansing Foam Peach,Myntra
2484943,30100251, Jeju Volcanic Lava Cleansing Foam,Myntra
12644894,30100512, Herb Day 365 Master Blending Foaming Cleanser - Mungbean & Mugwort ,Myntra
12644886,30100510, Herb Day 365 Cleansing Foam Lemon,Myntra
7249623,30100061, All Clear All In One Foaming Cleanser,Myntra
12644890,30100511, Herb Day 365 Cleansing Foam Aloe,Myntra
12644892,30100509, Herb Day 365 Acerola Cleansing Foam,Myntra
16728390,30100554,Rice Water Bright Foaming Cleanser 100Ml,Myntra
2484933,30100050,Herbday 365 Cleansing Foam Peach,Myntra
2484937,30100054,Herbday 365 Cleansing Foam Mung Bean,Myntra
18266296,30100513,Thefaceshop Chia Seed Hydrating Trio Kit,Myntra
2484935,30100052,Herbday 365 Cleansing Foam Lemon,Myntra
2484936,30100053,Herbday 365 Cleansing Foam Aloe,Myntra
2484934,30100051,Herbday 365 Cleansing Foam Acerola,Myntra
15113398,30100543,Jeju Aloe Fresh Soothing Foam Cleanser,Myntra
22747034,TFSCOM00364,Glow Starter Kit,Myntra
15111874,30100538,Dr.Belmeur Amino Clear Cleansing Foaming Cleanser,Myntra
24854006,30100574,Tea Tree Gel Cleanser,Myntra
24854010,30100575,Mango Seed Creamy Foaming Cleanser,Myntra
24853996,30100576,All Clear Micellar All-In-One Cleansing Foam,Myntra
7249643,30100100, Essential Damage Care Hair Serum,Myntra
7249628,30100101, Essential Damage Care Hair Oil Serum,Myntra
7249632,30100099, Essential Damage Care Dual Deep Treatment Pack,Myntra
9113703,30100440, Dr.Schwarz Shampoo For Damaged Hair,Myntra
9113679,30100441, Dr.Schwarz Hair Treatment,Myntra
10558974,30100464, Rich Hand V Special Care Hand Mask,Myntra
10558976,30100453, My Plant Hand Cream - Good Luck,Myntra
10558964,30100454, My Plant Hand Cream - Good Job,Myntra
10558966,30100455, My Plant Hand Cream - Good Day,Myntra
2484945,30100154, Lovely Meex Mini Pet Hand Cream 03 White Floral,Myntra
2484946,30100155, Lovely Meex  Mini Pet Hand Cream 04 Fruity Floral,Myntra
11378368,30100497, Holiday Special Hand Cream Set,Myntra
9202487,30100408, Daily Perfumed Hand Lotion Orchid,Myntra
10558986,30100467, Daily Perfume Hand Cream Real Peach,Myntra
10558954,30100466, Daily Perfume Hand Cream Grapefruit,Myntra
10558950,30100468, Daily Perfume Hand Cream Avocado,Myntra
2484952,30100067, Daily Perfume Hand Cream 06 Cherry Blossom,Myntra
2484951,30100066, Daily Perfume Hand Cream 05 Green Tea,Myntra
2484947,30100062, Daily Perfume Hand Cream 01 Rose Water,Myntra
8481583,30100340,Sweet Apeach Hand Cream,Myntra
2484944,30100153,Lovely Meex Mini Pet Hand Cream 01 Baby Powder,Myntra
2485466,30100385,The Faceshop The Therapy Water Drop Anti Aging Moisturizing Serum,Myntra
2484956,30100070,Daily Perfume Hand Cream Snowcotton,Myntra
2484949,30100064,Daily Perfume Hand Cream Applepop,Myntra
2484954,30100069,Daily Perfume Hand Cream 08 Acaciahoney,Myntra
2484953,30100068,Daily Perfume Hand Cream 07 Macadamia,Myntra
2484950,30100065,Daily Perfume Hand Cream 04 Berry Mix,Myntra
2484948,30100063,Daily Perfume Hand Cream 02 Tiare,Myntra
24853998,30100564, Daily Moment Vegan Hand Cream - Sunrise Bedroom,Myntra
24853980,30100565, Daily Moment Vegan Hand Cream - Morning Florist,Myntra
24854008,30100566, Daily Moment Vegan Hand Cream - Noon Park,Myntra
2484894,30100379,"The Faceshop Power Perfection Bb Cream Spf37, Pa++V203-1",Myntra
2484900,30100378,"The Faceshop Power Perfection Bb Cream Spf37, Pa++V201-1",Myntra
2484896,30100380,"The Faceshop Power Perfection Bb Cream Spf37, Pa++ V301-1",Myntra
24853992,30100567, Daily Moment Vegan Hand Cream - Sunset Rooftop,Myntra
7249646,30100373,The Faceshop Milk & Shea Butter Rich Body Cream,Myntra
7249638,30100374,The Faceshop Essential Style Up Curling Serum,Myntra
24853978,30100568, Daily Moment Vegan Hand Cream - Midnight Street,Myntra
10317291,TFSCOM00168, Working Women Kit_V2,Myntra
11353946,TFSCOM00248, ValetineS Day Kit 2020_1,Myntra
8515945,TFSCOM00131,The Face Shop Valentines Day Pouch(300gm),Myntra
11378370,30100499, Yehwadam Revitalizing Travel Kit,Myntra
11378366,30100500, Yehwadam Pure Brightening Travel Kit,Myntra
13523754,TFSCOM00273, Valentines Day Kit,Myntra
10755064,TFSCOM00235, Troubled Skincare Kit,Myntra
9815549,TFSCOM00154, Travel Kit,Myntra
10755072,TFSCOM00227, The Og Glow Kit,Myntra
16234198,TFSCOM00334, Thanksgiving Kit,Myntra
9815547,TFSCOM00156, Skincare Strater Kit_Ru,Myntra
16033626,TFSCOM00331, Shine Like A Star Gift Box,Myntra
16052492,TFSCOM00330, Secret To Glow Gift Box,Myntra
20359982,TFSCOM00351, Rice Cleanser And Emulsion Combo,Myntra
10755070,TFSCOM00228, Perfect Skin Kit,Myntra
10755058,TFSCOM00233, Lip Squared Combo,Myntra
10755066,TFSCOM00232, Its Time To Glow Kit,Myntra
10755062,TFSCOM00229, Good Mood Skin Kit,Myntra
10755068,TFSCOM00230, Getback To Glow Kit,Myntra
10755060,TFSCOM00231, Get Your Glow On Kit,Myntra
11378364,30100501, Dr.Belmeur Advanced Cica Travel Kit,Myntra
11128150,30100495, Club Ryan Body Care Travel Kit,Myntra
10755074,TFSCOM00234, Cleansing Cube Kit,Myntra
11378362,30100498, Chia Seed Travel Kit,Myntra
16170982,TFSCOM00333, Brightening Experts Kit,Myntra
12864614,TFSCOM00256, Addictive Skincare Kit,Myntra
17242626,30100529,Rice&Ceramide Moisturizing Skincare Set,Myntra
20360446,TFSCOM00353,Rice & Ceramide Barrier Repair Combo,Myntra
4320612,30100042,Dr.Belmeur Daily Repair Starter Kit,Myntra
13430126,30100507, Lip Scrub - Shea Butter,Myntra
10583244,30100475, Lip Care Stick - Shea Butter,Myntra
10583246,30100476, Lip Care Stick - Pomegranate,Myntra
10583236,30100477, Lip Care Cream - Shea Butter,Myntra
10583238,30100478, Lip Care Cream - Mango,Myntra
10602778,30100280, Dr.Belmeur Daily Repair Moisturizing Lip Balm,Myntra
7249619,30100218,Watery Tint Lip Stain -Rose Garden,Myntra
7249627,30100213,Watery Tint Lip Stain -Pink Bella,Myntra
7249625,30100216,Watery Tint Lip Stain - Red Up,Myntra
7249648,30100215,Watery Tint Lip Stain - Orange Scene,Myntra
7249641,30100214,Watery Tint Lip Stain - Coralster,Myntra
7249645,30100217,Watery Tint Lip Stain - Cherry Red,Myntra
10583250,30100470, Water Fit Lip Tint - Rose Pink,Myntra
10583234,30100473, Water Fit Lip Tint - Red Signal,Myntra
10583240,30100471, Water Fit Lip Tint - Pink Mate,Myntra
10583248,30100472, Water Fit Lip Tint - Picnic Red,Myntra
10583242,30100474, Water Fit Lip Tint - Cherry Kiss,Myntra
11128156,30100487, Club Ryan Velvet Lip Tint - Soft Brown,Myntra
11128162,30100485, Club Ryan Velvet Lip Tint - Lively Pink,Myntra
11128154,30100484, Club Ryan Velvet Lip Tint - Graceful Rose,Myntra
11128148,30100486, Club Ryan Velvet Lip Tint - Energy Red,Myntra
8481589,30100343,Hoodie Ryan Blossom Tint Red It Hoodie Ryan,Myntra
8488653,30100342,Hoodie Ryan Blossom Tint Coralful Hoodie Ryan,Myntra
8481587,30100345,Apeach Blossom Tint Ready Red Apeach,Myntra
8481585,30100344,Apeach Blossom Tint Pink Peach Apeach,Myntra
2484899,30100197,Waterproof  Bb V203,Myntra
2484903,30100196,Waterproof  Bb V201,Myntra
2484851,30100175,Triple Eyes Rose Nuance,Myntra
2484852,30100176,Triple Eyes Purple Nuance,Myntra
2484850,30100174,Triple Eyes Orange Nuance,Myntra
2484853,30100177,Triple Eyes Mocha Nuance,Myntra
2484811,30100181,The Therapy Cushion Spf 50+ N203,Myntra
2484819,30100180,The Therapy Cushion Spf 50+ N201,Myntra
13430124,30100505, Freshian Mascara - Volume,Myntra
15112048,30100531, Fmgt Designing Eyebrow Pencil 05 Dark Brown ,Myntra
2484924,30100188, Collagen Ampoule Lipstick - 05 Blessing Pink,Myntra
2484897,30100198,Power Perfection  Bb V301,Myntra
2484895,30100183,Power Perfection  Bb V203,Myntra
2484901,30100182,Power Perfection  Bb V201,Myntra
2484824,30100221,Oil Control Water Cushion Spf 50+ Pa+++ V203,Myntra
2484823,30100220,Oil Control Water Cushion Spf 50+ Pa+++ V201,Myntra
2484822,30100219,Oil Control Water Cushion Spf 50+ Pa+++ V103,Myntra
8488651,30100341,Oil Clear Blotting Powder Kakao Friends,Myntra
8501941,30100338,Natural Sun Eco Baby Mild Sunscreen Cushion Spf 28 Pa++ Kakao Friends,Myntra
2484898,30100195,Magic Cover  Bb V203,Myntra
2484902,30100194,Magic Cover  Bb V201,Myntra
2484793,30100173,Ink Graffi Liquid Liner 01 Full Black,Myntra
13430122,30100506,Freshian Mascara 01 Curling,Myntra
15112046,30100535,Fmgt Designing Eyebrow Pencil 05 Dark Brown,Myntra
15112054,30100549,Fmgt Designing Eyebrow Pencil 04 Black Brown,Myntra
15112044,30100534,Fmgt Designing Eyebrow Pencil 03 Brown,Myntra
8372071,30100282,Dr.Belmeur Daily Repair Tone-Up Cushion,Myntra
2484848,30100271,Dr.Belmeur Daily Repair Calamine Tone-Up Cushion,Myntra
2484908,30100272,Dr.Belmeur Daily Repair Blemish Balm Cushion,Myntra
8372073,30100283,Dr.Belmeur Daily Repair Blemish Balm Cushion,Myntra
2484920,30100184,Collagen Ampoule Lipstick - Bridal Pink,Myntra
2484923,30100187,Collagen Ampoule Lipstick -  Rhythm Pink,Myntra
2484922,30100186,Collagen Ampoule Lipstick -  Pink Nouveau,Myntra
2484925,30100189,Collagen Ampoule Lipstick -  Pink Bella,Myntra
2484929,30100193,Collagen Ampoule Lipstick -  Orange Blast,Myntra
2484921,30100185,Collagen Ampoule Lipstick -  Merry Pink,Myntra
2484928,30100192,Collagen Ampoule Lipstick -  Mandarin,Myntra
2484927,30100191,Collagen Ampoule Lipstick -  Gel Coral,Myntra
2484926,30100190,Collagen Ampoule Lipstick -  Full Pink,Myntra
11128158,30100488,Club Ryan Oil Control Pore Balm,Myntra
2484832,30100227,Cc Ultra Moist Cushion Spf 50+ Pa+++ V203,Myntra
2484831,30100226,Cc Ultra Moist Cushion Spf 50+ Pa+++ V201,Myntra
2484830,30100225,Cc Ultra Moist Cushion Spf 50+ Pa+++ V103,Myntra
2484842,30100232,Cc Long-Lasting Cushion Spf 50+ Pa+++V207,Myntra
2484841,30100231,Cc Long-Lasting Cushion Spf 50+ Pa+++V205,Myntra
2484840,30100208,Cc Long-Lasting Cushion Spf 50+ Pa+++ V203,Myntra
2484839,30100207,Cc Long-Lasting Cushion Spf 50+ Pa+++ V201,Myntra
2484838,30100206,Cc Long-Lasting Cushion Spf 50+ Pa+++ V103,Myntra
2484829,30100224,Cc Intense Cover Cushion Spf 50+ Pa+++ V203,Myntra
9075019,TFSFREE00025,The face shop Passport Cover,Myntra
2484828,30100223,Cc Intense Cover Cushion Spf 50+ Pa+++ V201,Myntra
2484827,30100222,Cc Intense Cover Cushion Spf 50+ Pa+++ V103,Myntra
2484849,30100202,Cc Highlighting Cushion,Myntra
2484837,30100230,Cc Cooling Cushion Spf 42 Pa+++V207,Myntra
2484836,30100229,Cc Cooling Cushion Spf 42 Pa+++V205,Myntra
2484835,30100205,Cc Cooling Cushion Spf 42 Pa+++ V203,Myntra
2484834,30100204,Cc Cooling Cushion Spf 42 Pa+++ V201,Myntra
2484833,30100203,Cc Cooling Cushion Spf 42 Pa+++ V103,Myntra
2484907,30100212,Cc Contouring Cushion,Myntra
2484906,30100201,Cc Concealing Cushion V203,Myntra
2484905,30100200,Cc Concealing Cushion V201,Myntra
2484904,30100199,Cc Concealing Cushion V103,Myntra
2484941,30100044,Bubble Foam Cleanser,Myntra
2484846,30100233,Bb Power Perfection Cushion Spf 50+ Pa+++V205,Myntra
2484845,30100211,Bb Power Perfection Cushion Spf 50+ Pa+++ V203,Myntra
2484844,30100210,Bb Power Perfection Cushion Spf 50+ Pa+++ V201,Myntra
2484843,30100209,Bb Power Perfection Cushion Spf 50+ Pa+++ V103,Myntra
2484847,30100234,Bb Power Perfection Cushion Spf 50 +Pa+++V207,Myntra
2484930,30100002, Rice Water Bright Mild Cleansing Water,Myntra
2484957,30100001, Rice Water Bright Lip & Eye Makeup Remover,Myntra
8909489,30100351, Rice Water Bright Light Cleansing Oil,Myntra
8909485,30100350, Rice Water Bright Facial Massage Cream,Myntra
4320619,30100057, Rice Water Bright Cleansing Lotion,Myntra
8909493,30100349, Rice Water Bright Cleansing Cream,Myntra
8351349,30100354, Mango Seed Lip & Eye Make Up Remover,Myntra
8909483,30100352,Rice Water Bright Rich Cleansing Oil,Myntra
9202489,30100542,Herb Day Lip&Eye Makeup Remover Wipes,Myntra
9202501,30100452, Herb Day Cleansing Tissue,Myntra
9106049,30100404, Herb Day Cleansing Cream Green Tea,Myntra
9106027,30100406, Herb Day Cleansing Cream Fruit Mix,Myntra
9106021,30100405, Herb Day Cleansing Cream Aloe,Myntra
2484939,30100038, Dr.Belmeur Daily Repair Moist Cleansing Micellar Water,Myntra
7249640,30100059, All Clear One Swipe Makeup Removal Cleansing Water,Myntra
9106005,30100407, All Clear One Shot Cleansing Oil,Myntra
9106033,30100060, All Clear Cleansing Oil Whip,Myntra
15111876,30100537,Dr.Belmeur Amino Clear Cleansing Water,Myntra
4320620,30100039,Daily Repair Cleanser,Myntra
20652258,TFSCOM00316,Unisex Combination Skin Masksheet Combo (Pack of 10),Myntra
2484882,30100116,The Solution Wrinkle Care Face Mask,Myntra
2484886,30100117,The Solution Smoothing Face Mask,Myntra
2484880,30100115,The Solution Radiance Face Mask,Myntra
2484795,30100376,The Face Shop Ink Graffi Brush Pen Liner 02 Ink Brown,Myntra
2484794,30100375,The Face Shop Ink Graffi Brush Pen Liner 01 Ink Black,Myntra
10559190,TFSCOM00173,The Faceshop Best Served Chilled Reset Your Skin Kit(7pcs),Myntra
8059719,30100269,The Face Shop Yehwadam Revitalizing Moisturizing Face Mask(25ml),Myntra
12639738,TFSCOM00251,The Face Shop Workaholics Pack of 7 Combo,Myntra
7572921,TFSCOM00014,The Face Shop Who Needs Luminizer Combo ( Pack Of 7 ),Myntra
9451821,TFSCOM00135,The Face Shop Travelers Pick Masksheet Kit Pack Of 7,Myntra
2484884,30100010,The Face Shop The Solution Soothing Face Mask(20gm),Myntra
2484885,30100011,The Face Shop The Solution Pore Care Face Mask(20gm),Myntra
2484883,30100009,The Face Shop The Solution Nourishing Face Mask(20gm),Myntra
2484878,30100006,The Face Shop The Solution Moisturizing Face Mask(20gm),Myntra
2484877,30100005,The Face Shop The Solution Hydrating Face Mask(20gm),Myntra
2484881,30100008,The Face Shop The Solution Firming Face Mask(20gm),Myntra
2484879,30100007,The Face Shop The Solution Brightening Face Mask(20gm),Myntra
9451815,TFSCOM00133,The Face shop Summer Kit(Pack of 7),Myntra
12639740,TFSCOM00252,The Face Shop Serial Chiller Pack of 7 Combo,Myntra
6687974,30100140,The Face Shop Real Nature Tea Tree Face Mask(20gm)(Tea Tree),Myntra
2484866,30100023,The Face Shop Real Nature Shea Butter Face Mask(20gm)(Shea Butter),Myntra
6687977,30100015,The Face Shop Real Nature Rice Face Mask(20gm)(Rice),Myntra
7979573,30100028,The Face Shop Real Nature Red Ginseng Face Mask(20gm)(Red Ginseng),Myntra
6687975,30100150,The Face Shop Real Nature Potato Face Mask(20gm)(Potato),Myntra
2484863,30100021,The Face Shop Real Nature Pomegranate Face Mask(20gm)(Pomegranate),Myntra
2484870,30100126,The Face Shop Real Nature Peony Face Mask(20gm),Myntra
6687979,30100019,The Face Shop Real Nature Olive Face Mask(20gm)(Olive),Myntra
2484861,30100394,The Face Shop Real Nature Olive Face Mask(20gm),Myntra
7981799,30100016,The Face Shop Real Nature Mung Bean Face Mask(20gm)(Mung Bean),Myntra
2484867,30100024,The Face Shop Real Nature Lotus Face Mask(20gm)(Lotus),Myntra
7985045,30100399,The Face Shop Real Nature Lotus Face Mask(20gm),Myntra
2484875,30100027,The Face Shop Real Nature Lingzhi Face Mask(20gm)(Lingzhi),Myntra
7981523,30100014,The Face Shop Real Nature Lemon Face Mask(20gm)(Lemon),Myntra
2484859,30100017,The Face Shop Real Nature Kelp Face Mask(20gm)(Kelp),Myntra
2484860,30100018,The Face Shop Real Nature Honey Miel Face Mask(20gm)(Honey),Myntra
7987629,30100026,The Face Shop Real Nature Green Tea Face Mask(20gm)(Green Tea),Myntra
13762144,60100009,Belif The Ture Cream-Aqua Bomb,Myntra
13762136,60100008,Belif The True Cream Aqua Bomb 25Ml,Myntra
7588975,TFSFREE00007,Sheet Happens Pouch,Myntra
6687976,30100013,The Face Shop Real Nature Cucumber Face Mask(20gm)(Cucumber),Myntra
7984013,30100025,The Face Shop Real Nature Calendula Face Mask(20gm)(Calendula),Myntra
9280029,30100360,Rice Water Bright Mild Cleansing Water 110ml,Myntra
9280035,30100371,Rice Water Bright Light Cleansing Oil 55ml,Myntra
6687973,30100022,The Face Shop Real Nature Blueberry Face Mask(20gm)(Blueberry),Myntra
9280033,30100367,Rice Water Bright Foaming Cleanser 50ml,Myntra
11563486,30100443,Rice Water Bright Cleansing Foam 100ml,Myntra
6687978,30100149,The Face Shop Real Nature Bamboo Face Mask(20gm)(Bamboo),Myntra
2484862,30100020,The Face Shop Real Nature Avocado Face Mask(20gm)(Avocado),Myntra
6687972,30100012,The Face Shop Real Nature Aloe Face Mask(20gm)(Aloe),Myntra
2484854,30100387,The Face Shop Real Nature Aloe Face Mask(20gm),Myntra
7572920,TFSCOM00017,The Face Shop Moistful Travel Combo ( Pack Of 7 ),Myntra
9106029,30100427,The Face Shop Mask.Lab Ultra Moisturizing Lift Up Face Mask(28ml),Myntra
9106043,30100429,The Face Shop Mask.Lab Lift Up Face Mask(25ml),Myntra
9106011,30100428,The Face Shop Mask.Lab Brightening Lift Up Face Mask(25ml),Myntra
9106037,30100422,The Face Shop Mascream Intense Sheet - Soothing(20gm),Myntra
9106013,30100423,The Face Shop Mascream Intense Sheet - Moisturizing(20gm),Myntra
9202491,30100425,The Face Shop Intense Hydrating MasCream Sheet(30gm),Myntra
9202497,30100424,The Face Shop Intense Elasticity MasCream Sheet(30gm),Myntra
7572923,TFSCOM00013,The Face Shop Hello! Handsome Combo ( Pack Of 7 ),Myntra
12639734,TFSCOM00250,The Face Shop Gym Enthusiast Pack of 7 Combo,Myntra
10602780,TFSCOM00165,The Face Shop Glow In Rain Masksheet Combo (Pack of 7),Myntra
9451819,TFSCOM00134,The Face Shop Glow Getter Combo(Pack of 7),Myntra
12639736,TFSCOM00253,The Face Shop Globe Trotter Pack of 7 Combo,Myntra
9106023,30100426,The Face Shop Daily Green Tea Face Mask(350gm),Myntra
7572925,TFSCOM00012,The Face Shop City Pore-Tection Combo ( Pack Of 7 ),Myntra
2484887,30100118,The Face Shop Bio-Cell Moisturizing Face Mask(25gm),Myntra
2484888,30100119,The Face Shop Bio-Cell Brightening Face Mask(25gm),Myntra
