Channel_SKU,Master_SKU,SKU_Name,Channel
306931,BLFCOM00004, Travel Kit 2.0,Foxy
306984,30100003, Rice Water Bright Foaming Cleanser,Foxy
306986,TFSCOM00359,Honeymoon Kit -  Meets Pep Nails,Foxy
308690,70100022,DHC Beauty LX-ME Brightening Lotion,Foxy
309108,30100574,Tea Tree Gel Cleanser,Foxy
315050,BLFCOM00012, Wave of Hydration,Foxy
293264,60100062, aqua bomb Jelly cleanser _160ml,Foxy
306783,20100003, Go-To-Bed Sleeping Mask 50gm,Foxy
309113,30100562,Tea Tree Pore Cream,Foxy
306768,20100007,Chief Glow Officer Serum-n-Cream 30ml,Foxy
309157,30100570,Dr.Belmeur Derma Collagen Neck Patch,Foxy
309136,30100572,Power Long-Lasting Suncream Spf50+ Pa+++,Foxy
308578,TFSCOM00350,Rwb 100Ml Combo (Pack Of 2),Foxy
309131,30100575,Mango Seed Creamy Foaming Cleanser,Foxy
309148,30100565, Daily Moment Vegan Hand Cream - Morning Florist,Foxy
324763,30100589, Chia Seed Hydro Cream(25ml),Foxy
324845,30100586,Rice & Ceramide Moisturizing Emulsion 70ml,Foxy
324846,30100351, Rice Water Bright Light Cleansing Oil,Foxy
324847,30100371,Rice Water Bright Light Cleansing Oil 55ml,Foxy
324848,30100413, Pomegranate And Collagen Volume Lifting Cream,Foxy
324766,30100587, Pomegranate And Collagen Volume Lifting Cream (50ml),Foxy
324767,30100588, White Seed Brightening Lotion (50ml),Foxy
324768,30100590, White Seed Brightening Serum (30ml),Foxy
324771,30100592,HERBDAY 365 MASTERBLENDING FOAMING CLEANSER LEMON,Foxy
324843,30100510, Herb Day 365 Cleansing Foam Lemon,Foxy
324844,30100417, Rice & Ceramide Moisturizing Emulsion,Foxy
324769,30100591, Pomegranate And Collagen Volume Lifting Serum(30ml),Foxy
143799,60100013, Numero 10 Essence 50Ml,Foxy
306763,70100008,DHC Beauty Acne Control Fresh Foaming Wash(130 g),Foxy
306790,70100016,DHC Pore Cleansing Oil 150ml,Foxy
306794,70100015,DHC Revitalizing Moisture Strips:Eyes (2 Sheets× 6 Pouches),Foxy
309152,30100566, Daily Moment Vegan Hand Cream - Noon Park,Foxy
316315,70100001,DHC Beauty Deep Cleansing Oil(30ml),Foxy
322931,30100421, Calendula Essential Moisture Eye Cream,Foxy
319281,30100584,Air Cotton Cushion SPF50+ PA++++ (203 Beige),Foxy
306781,70100006,DHC Beauty Lip Cream(1.5 g),Foxy
309156,30100568,Hand Cream Midnight,Foxy
304437,30100452,Herbday Cleansing Tissue,Foxy
304421,VIRSKU00084,The Face Shop Hydrated & Glowing Skin Combo,Foxy
298771,BELIF00000042,belif Oily Skin BFF Duo (Pack Of 2),Foxy
309109,30100560,Tea Tree Toner Pads,Foxy
345787,30100595,RWB Vegan Cream,Foxy
308701,70100024,DHC Beauty LX-ME Brightening Gel,Foxy
349019,DHCCOM00006,Deep Cleansing Oil Mini Combo,Foxy
349032,DHCCOM00007,Deep Cleansing Oil 70ml Combo,Foxy
319278,30100583,Air Cushion Light Beige,Foxy
346495,VIRSKU00091,The Face Shop Brightening Combo for Dry Skin(Pack of 3),Foxy
304440,VIRSKU00094,The Face Shop Multi-purpose Jeju Aloe Fresh Soothing Cleansing Foam Combo (Pack of 2),Foxy
348109,VIRCOM00012,Holiday Hues Combo,Foxy
345780,30100596,RWB Vegan Eye Cream,Foxy
324849,30100439,White Seed Lotion 145ml,Foxy
309154,30100567,Hand Cream Sunset,Foxy
293312,60100008,AB Cream 25ml,Foxy
349421,30100003,RWB Foam 150ml,Foxy
293293,60100058,Lip Bomb Pink,Foxy
293299,60100057,Lip Bomb Basic,Foxy
345435,60100074,Belif UV Protector Almighty Sun Stick (17ml),Foxy
373612,BLFCOM00013,belif Hydration heroes gift bag_Free - Default Title,Foxy
42158,30100014,The Face Shop Real Nature Lemon Face Mask,Swiggy
42157,30100015,The Face Shop Real Nature Rice Face Mask,Swiggy
42162,30100020,The Face Shop Real Nature Avocado Face Mask,Swiggy
42160,30100021,The Face Shop Real Nature Pomegranate Face Mask,Swiggy
42159,30100028,The Face Shop Real Nature Red Ginseng Face Mask,Swiggy
90995,30100026,Green Tea Face Mask with Green Tea Extract,Swiggy
93942,30100012,Aloe Face Mask with Aloe Vera Extract for Hydrating Skin,Swiggy
41318,30100150,The Face Shop Real Nature Potato Face Mask,Swiggy
78474,30100548,Real Nature Charcoal Face Mask,Swiggy
66170,30100417,Rice Ceramide moisturising emulsion,Swiggy
44265,30100416,Rice & Ceramide Moisturizing Toner,Swiggy
61511,30100022,Real Nature Blueberry Face Mask,Swiggy
78801,30100511,Herb Day 365 Cleansing Foam - Aloe,Swiggy
77291,30100474,Water Fit Lip Tint - Cherry Kiss,Swiggy
42781,30100351,The Face Shop Rice Water Bright Light Cleansing Oil,Swiggy
77472,30100592,HERBDAY 365 MASTERBLENDING FOAMING CLEANSER LEMON,Swiggy
94772,30100590, White Seed Brightening Serum (30ml),Swiggy
92369,30100539,Dr.Belmeur Clarifying Spot Soothing Patches,Swiggy
49979,30100587, Pomegranate And Collagen Volume Lifting Cream (50ml),Swiggy
58879,30100528, Naturalsun Eco No Shine Hydrating Sun Cream,Swiggy
80319,30100554,Rice Water Bright Foaming Cleanser 100Ml,Swiggy
56390,30100529,Rice&Ceramide Moisturizing Skincare Set,Swiggy
78314,30100105, Jeju Aloe Fresh Soothing Gel,Swiggy
64223,TFSCOM00364,Glow Starter Kit,Swiggy
49635,TFSCOM00304,Real Nature Glowing Bride Masksheet Combo (Pack of 10),Swiggy
42161,30100018, Real Nature Honey Miel Face Mask(20gm)(Honey),Swiggy
88595,30100544,Jeju Volcanic Lava Fresh Nose Strips,Swiggy
53888,10100005,"THE BETTER FLOUR IRON RICH BEETROOT FLOUR, GLUTEN FREE, LOW CARB, MULTIGRAIN FLOUR ATTA",Swiggy
55160,10100010,"THE BETTER FLOUR KHPLI WHOLE WHEAT ATTA, LOW GI, HIGH FIBRE FLOUR",Swiggy
67053,10100001,"THE BETTER FLOUR PROTEIN RICH GLUTEN FREE FLOUR, 100% NATURAL & CLEAN PROTEIN MULTIGRAIN ATTA",Swiggy
98290,10100003,"THE BETTER FLOUR VITAMIN RICH SPINACH FLOUR, GLUTEN FREE, LOW CARB, MULTIGRAIN FLOUR ATTA",Swiggy
51037,30100457,the face shop chia seed hydro lotion,Swiggy
492495043,30100014, Real Nature Lemon Face Mask(20gm)(Lemon),Tira Retail
492493951,30100003, Rice Water Bright Foaming Cleanser,Tira Retail
492494486,30100435, Rice & Ceramide Moisturizing Cream,Tira Retail
493685734,30100417, Rice & Ceramide Moisturizing Emulsion,Tira Retail
492493952,30100416, Rice & Ceramide Moisturizing Toner,Tira Retail
492500408,30100543,Jeju Aloe Fresh Soothing Foam Cleanser,Tira Retail
492874126,30100351, Rice Water Bright Light Cleansing Oil,Tira Retail
492495026,30100439, White Seed Brightening Lotion,Tira Retail
492494511,30100457, Chia Seed Vit B12 Hydro Lotion,Tira Retail
493914116,60100067, UV Protector multi sun screen_50ml,Tira Retail
492495024,30100438,White Seed Brightening Toner,Tira Retail
492874386,30100413, Pomegranate And Collagen Volume Lifting Cream,Tira Retail
493685739,30100250, Jeju Volcanic Lava Scrub Foam,Tira Retail
492495020,30100411, Pomegranate And Collagen Volume Lifting Emulsion,Tira Retail
494239429,30100569,The Therapy Vegan Moisturizing Sun Serum,Tira Retail
494239423,30100561,Tea Tree Pore Ampoule,Tira Retail
492495034,30100035, White Seed Brightening Serum,Tira Retail
494239424,30100562,Tea Tree Pore Cream,Tira Retail
493913923,60100052, the true cream moisturizing bomb 25ml,Tira Retail
492494514,30100352,Rice Water Bright Rich Cleansing Oil,Tira Retail
494239427,30100558,The Therapy Vegan Blending Toner,Tira Retail
492495023,30100414, Pomegranate And Collagen Volume Lifting Eye Cream,Tira Retail
494239428,30100571,The Therapy Vegan Sunscreen Stick Spf50+,Tira Retail
492495022,30100412, Pomegranate And Collagen Volume Lifting Serum,Tira Retail
493724764,60100062, aqua bomb Jelly cleanser _160ml,Tira Retail
492493960,30100456, Chia Seed Hydro Toner,Tira Retail
492874398,30100528, Naturalsun Eco No Shine Hydrating Sun Cream,Tira Retail
492493955,30100459, Chia Seed Hydro Cream,Tira Retail
493914119,60100052, the true cream moisturizing bomb 25ml,Tira Retail
493914102,60100057, moisturizing lip bomb basic_3g,Tira Retail
492495017,30100410, Pomegranate And Collagen Volume Lifting Toner,Tira Retail
493914115,60100058, moisturizing lip bomb the pink_3g,Tira Retail
492500388,60100013, Numero 10 Essence 50Ml,Tira Retail
492500387,60100017, Numero 10 Essence,Tira Retail
492874397,30100525, Naturalsun Eco Super Perfect Sun Cream Ex,Tira Retail
492500389,60100008, The True Cream Aqua Bomb 25Ml,Tira Retail
493685726,30100474, Water Fit Lip Tint - Cherry Kiss,Tira Retail
492495044,30100018, Real Nature Honey Miel Face Mask(20gm)(Honey),Tira Retail
492494516,30100105, Jeju Aloe Fresh Soothing Gel,Tira Retail
492875601,60100009, The Ture Cream-Aqua Bomb,Tira Retail
492500409,30100547,Jeju Volcanic Lava Impurity Removing Nose Pack,Tira Retail
493685721,30100251, Jeju Volcanic Lava Cleansing Foam,Tira Retail
494239422,30100560, Tea Tree Toner Pads,Tira Retail
494239421,30100574,Tea Tree Gel Cleanser,Tira Retail
492656739,30100072, Smile Foot Peeling Mask,Tira Retail
494239426,30100557,The Therapy Vegan Blending Cream,Tira Retail
492874389,30100473, Water Fit Lip Tint - Red Signal,Tira Retail
492875599,60100052, the true cream moisturizing bomb 25ml,Tira Retail
492875600,60100010, The True Cream moisturizing Bomb,Tira Retail
493685727,30100471, Water Fit Lip Tint - Pink Mate,Tira Retail
493685728,30100472, Water Fit Lip Tint - Picnic Red,Tira Retail
492495045,30100020, Real Nature Avocado Face Mask(20gm)(Avocado),Tira Retail
492495041,30100470, Water Fit Lip Tint - Rose Pink,Tira Retail
493724767,60100052, the true cream moisturizing bomb 25ml,Tira Retail
493717563,70100003,DHC Beauty Deep Cleansing Oil,Tira Retail
493717561,70100001,DHC Beauty Deep Cleansing Oil(30ml),Tira Retail
493717562,70100002,DHC Beauty Deep Cleansing Oil(70ml),Tira Retail
493717564,70100004,DHC Beauty Face Wash Powder(15 g),Tira Retail
492495054,30100026, Real Nature Green Tea Face Mask(20gm)(Green Tea),Tira Retail
493717565,70100005,DHC Beauty Face Wash Powder(50 g),Tira Retail
493717566,70100006,DHC Beauty Lip Cream(1.5 g),Tira Retail
494261797,30100513, Chia Seed Hydrating Trio Kit,Tira Retail
494261796,30100160,(Gwp Kit)White Seed Brigthening Discovery Kit,Tira Retail
494261795,30100555,Pomegranate & collagen duo kit,Tira Retail
494262289,70100024,DHC Beauty LX-ME Brightening Gel,Tira Retail
494262287,70100022,DHC Beauty LX-ME Brightening Lotion,Tira Retail
494262288,70100023,DHC Beauty LX-ME Brightening Emulsion,Tira Retail
493717569,70100014,DHC Facial Scrub 100gm,Tira Retail
493717573,70100018,DHC Medicated Skin Conditioner Face Wash 100gm,Tira Retail
493717575,70100020,DHC Mild Foaming Face Wash 100gm,Tira Retail
493717574,70100019,DHC Mineral Face Wash 100gm,Tira Retail
493717571,70100016,DHC Pore Cleansing Oil 150ml,Tira Retail
493717572,70100017,DHC Pore Face Wash 120gm,Tira Retail
493717568,70100013,DHC Pore Lotion 120ml,Tira Retail
492500420,30100527, Naturalsun Eco No Shine Sun Powder,Tira Retail
494239425,30100563,The Therapy Vegan Moisture Blending Cream,Tira Retail
492495053,30100022, Real Nature Blueberry Face Mask(20gm)(Blueberry),Tira Retail
493717570,70100015,DHC Revitalizing Moisture Strips:Eyes (2 Sheets× 6 Pouches),Tira Retail
493717567,70100012,DHC Vitamin C Essence 25ml,Tira Retail
493914111,BLFCOM00008, The Glow Duo,Tira Retail
493914106,60100059, moisturizing lip bomb  coral_3g,Tira Retail
493914105,60100063, stress shooter-cica lip sugar scrub _10g,Tira Retail
493914104,60100064, stress shooter-cica lip essence repair_10g,Tira Retail
493914103,60100065, stress shooter-cica lip mask_20ml,Tira Retail
494342446,30100583,Air Cotton Cushion SPF50+ PA++++ (201 Light Beige),Tira Retail
493724769,BLFCOM00004, Travel Kit 2.0,Tira Retail
493724768,60100012, Uv Protector Multi Sun Screen,Tira Retail
493724765,60100061, aqua bomb sleeping mask _75ml,Tira Retail
492500418,30100523, Naturalsun Eco Super Active Sun Cream,Tira Retail
493717576,DHCCOM00005,DHC x  Let’s Get Glowing Kit,Tira Retail
494342448,30100585,Air Cotton Cushion SPF50+ PA++++ (205 Dark Beige),Tira Retail
494239434,30100576,All Clear Micellar All-In-One Cleansing Foam,Tira Retail
492493944,30100465, Smile Foot Mask,Tira Retail
492495036,30100419, Calendula Essential Moisture Emulsion,Tira Retail
492495032,30100447, Calendula Essential Moisture Cream,Tira Retail
492495018,30100420, Calendula Essential Moisture Serum,Tira Retail
492495016,30100418, Calendula Essential Moisture Toner,Tira Retail
492494469,30100421, Calendula Essential Moisture Eye Cream,Tira Retail
494239437,30100566, Daily Moment Vegan Hand Cream - Noon Park,Tira Retail
493914118,60100013, Numero 10 Essence 50Ml,Tira Retail
494239439,30100568, Daily Moment Vegan Hand Cream - Midnight Street,Tira Retail
494239436,30100565, Daily Moment Vegan Hand Cream - Morning Florist,Tira Retail
493913924,60100008, The True Cream Aqua Bomb 25Ml,Tira Retail
493724766,60100008, The True Cream Aqua Bomb 25Ml,Tira Retail
494239435,30100564, Daily Moment Vegan Hand Cream - Sunrise Bedroom,Tira Retail
494239438,30100567, Daily Moment Vegan Hand Cream - Sunset Rooftop,Tira Retail
494239431,30100573,Dr.Belmeur Derma Collagen Eye Patches,Tira Retail
494239430,30100570,Dr.Belmeur Derma Collagen Neck Patch,Tira Retail
493622924,TFSCOM00304,Real Nature Glowing Bride Masksheet Combo (Pack of 10),Tira Retail
492493953,30100048, Dr.Belmeur Spot Patch Kit (80 Patches),Tira Retail
492874477,30100047, Dr.Belmeur Clarifying Spot Care Ampoule,Tira Retail
492874283,30100531, Fmgt Designing Eyebrow Pencil 05 Dark Brown ,Tira Retail
492928127,30100016, Real Nature Mung Bean Face Mask(20gm)(Mung Bean),Tira Retail
492925371,TFSCOM00253, Globe Trotter Pack of 7 Combo,Tira Retail
492925369,TFSCOM00252, Serial Chiller Pack of 7 Combo,Tira Retail
492925368,TFSCOM00251, Workaholics Pack of 7 Combo,Tira Retail
492925367,TFSCOM00250, Gym Enthusiast Pack of 7 Combo,Tira Retail
492925220,30100453, My Plant Hand Cream - Good Luck,Tira Retail
492875606,60100021, Hungarian Water Essence-Moisture Binder,Tira Retail
492875605,60100029, Hungarian Water Essence,Tira Retail
492875604,60100035, Cleansing Oil Fresh,Tira Retail
492875603,60100047, Classic Esssence Increment,Tira Retail
492875602,60100022, Problem Solution Green Toner,Tira Retail
492875598,TFSCOM00153, Travel Kit,Tira Retail
492875597,60100016,The  True Cream Water Bomb Drop,Tira Retail
492875596,60100023, Mild And Effective Facial Scrub,Tira Retail
492875595,60100019, Hand Cream My Lime,Tira Retail
492875594,60100018, Hand Cream Lavender Sky,Tira Retail
492875593,60100025, Extreme Hand Cream Roseose,Tira Retail
492875592,60100028, Witch Hazel Herbal Extract Toner,Tira Retail
492875591,60100051, Manology 101 Free Toner,Tira Retail
492875590,60100020, White Decoxtion Toning Water,Tira Retail
492875589,30100006, The Solution Moisturizing Face Mask(20gm),Tira Retail
492875588,30100019, Real Nature Olive Face Mask(20gm)(Olive),Tira Retail
492875587,30100149, Real Nature Bamboo Face Mask(20gm)(Bamboo),Tira Retail
492875586,30100027, Real Nature Lingzhi Face Mask(20gm)(Lingzhi),Tira Retail
492875585,30100005, The Solution Hydrating Face Mask(20gm),Tira Retail
492875584,30100023, Real Nature Shea Butter Face Mask(20gm)(Shea Butter),Tira Retail
492875583,30100017, Real Nature Kelp Face Mask(20gm)(Kelp),Tira Retail
492875582,30100140, Real Nature Tea Tree Face Mask(20gm)(Tea Tree),Tira Retail
492875581,30100025, Real Nature Calendula Face Mask(20gm)(Calendula),Tira Retail
492875580,60100044, Peat Miracle Revital Cream,Tira Retail
492875579,60100041, Peat Miracle Revital Eye Cream,Tira Retail
492874479,30100541,Dr.Belmeur Clarifying Ultra Soothing Patches,Tira Retail
492874478,30100536,Yehwadam Silky Smooth Body Peeling Gel,Tira Retail
492657419,30100107, Jeju Aloe Fresh Soothing Gel Tube,Tira Retail
492874405,30100554,Rice Water Bright Foaming Cleanser 100Ml,Tira Retail
492874404,30100545,Jeju Volcanic Lava Calming Nose Strips,Tira Retail
492874402,30100538,Dr.Belmeur Amino Clear Cleansing Foaming Cleanser,Tira Retail
492874401,30100537,Dr.Belmeur Amino Clear Cleansing Water,Tira Retail
492874400,30100549,Fmgt Designing Eyebrow Pencil 04 Black Brown,Tira Retail
492874399,30100529,Rice&Ceramide Moisturizing Skincare Set,Tira Retail
492874396,30100524, Naturalsun Eco Super Aqua Sun Cream,Tira Retail
492874395,30100509, Herb Day 365 Acerola Cleansing Foam,Tira Retail
492874394,30100478, Lip Care Cream - Mango,Tira Retail
492874393,30100046, Dr.Belmeur Clarifying Moisturizer,Tira Retail
492874392,30100497, Holiday Special Hand Cream Set,Tira Retail
492874391,30100475, Lip Care Stick - Shea Butter,Tira Retail
492874390,30100476, Lip Care Stick - Pomegranate,Tira Retail
492874388,30100461, Natural Sun Eco Super Perfect Sun Fluid 50+ Pa+++,Tira Retail
492874387,30100481, Mango Seed Moisturizing Eye Cream,Tira Retail
492874385,30100496, Herb Day 365 Master Blending Foam Cleanser Special Set,Tira Retail
492874294,30100540,Dr.Belmeur Clarifying After Spot Cover Patches,Tira Retail
492874293,30100521, Dr.Belmeur Clean Face Mild Lotion,Tira Retail
492874292,30100511, Herb Day 365 Cleansing Foam Aloe,Tira Retail
492874291,30100535,Fmgt Designing Eyebrow Pencil 05 Dark Brown,Tira Retail
492874290,30100505, Freshian Mascara - Volume,Tira Retail
492874289,30100520, Dr.Belmeur Clean Face Mild Toner,Tira Retail
492874288,30100508, Herb Day 365 Cleansing Foam Peach,Tira Retail
492874287,30100045, Dr.Belmeur Clarifying Toner,Tira Retail
492874286,30100539,Dr.Belmeur Clarifying Spot Soothing Patches,Tira Retail
492874285,30100510, Herb Day 365 Cleansing Foam Lemon,Tira Retail
492874284,30100512, Herb Day 365 Master Blending Foaming Cleanser - Mungbean & Mugwort ,Tira Retail
492874238,30100007, The Solution Brightening Face Mask(20gm),Tira Retail
492874128,30100448, Green Natural Seed Antioxidant Toner,Tira Retail
492671394,TFSCOM00138, Acne-Proof Masksheet Kit Pack Of 7,Tira Retail
492671393,TFSCOM00210, Unisex Real Nature Bestseller Combo (Pack of 10),Tira Retail
492671392,TFSCOM00269, Unisex Anti-Acne Combo (Pack of 10),Tira Retail
492671391,TFSCOM00208, Unisex Glowing Masksheet Combo (Pack of 10),Tira Retail
492671390,TFSCOM00213, Unisex Soothing and Relaxing Masksheet Combo (Pack of 10),Tira Retail
492671389,TFSCOM00226, Unisex Instant Non-Sticky Moisturising Masksheet Combo (Pack of 7),Tira Retail
492671388,TFSCOM00225, Unisex Weekly Acne Treatment Masksheet Combo (Pack of 7),Tira Retail
492671387,TFSCOM00209, Unisex Real Nature Hydrating Masksheet Combo (Pack of 10),Tira Retail
492671386,TFSCOM00211, Unisex Dry Skin Masksheet Combo (Pack of 10),Tira Retail
492671385,TFSCOM00222, Unisex Instantly Hydrating Masksheet Combo (Pack of 7),Tira Retail
492659187,30100024, Real Nature Lotus Face Mask(20gm)(Lotus),Tira Retail
492658704,30100409, Smile Foot Peeling Jelly Mask,Tira Retail
492658392,30100455, My Plant Hand Cream - Good Day,Tira Retail
492658391,30100405, Herb Day Cleansing Cream Aloe,Tira Retail
492657620,30100407, All Clear One Shot Cleansing Oil,Tira Retail
492657619,30100451, All Over Perfumed Mist Baby Musk,Tira Retail
492657420,30100464, Rich Hand V Special Care Hand Mask,Tira Retail
492494479,30100251, Jeju Volcanic Lava Cleansing Foam,Tira Retail
492657418,30100408, Daily Perfumed Hand Lotion Orchid,Tira Retail
492657417,30100094, The Fresh For Men Hydrating Toner,Tira Retail
492494570,30100250, Jeju Volcanic Lava Scrub Foam,Tira Retail
492656743,30100066, Daily Perfume Hand Cream 05 Green Tea,Tira Retail
494239432,30100575,Mango Seed Creamy Foaming Cleanser,Tira Retail
492656535,30100062, Daily Perfume Hand Cream 01 Rose Water,Tira Retail
492656533,30100430, White Seed Exfoliating Cleansing Foam,Tira Retail
492655920,30100245, Jeju Volcanic Lava Volcanic Ash Nose Strip - 7Pcs,Tira Retail
492655752,30100067, Daily Perfume Hand Cream 06 Cherry Blossom,Tira Retail
492500419,30100526, Naturalsun Eco No Shine Sun Primer,Tira Retail
492500417,30100483, Mango Seed Radiant Moisturizing Oil,Tira Retail
492500407,30100507, Lip Scrub - Shea Butter,Tira Retail
492500406,30100534,Fmgt Designing Eyebrow Pencil 03 Brown,Tira Retail
494239433,30100572,Power Long-Lasting Suncream Spf50+ Pa+++,Tira Retail
492500386,60100014, White Decoxtion Brightening Foam,Tira Retail
492495052,30100021, Real Nature Pomegranate Face Mask(20gm)(Pomegranate),Tira Retail
492495051,30100010, The Solution Soothing Face Mask(20gm),Tira Retail
492495046,30100028, Real Nature Red Ginseng Face Mask(20gm)(Red Ginseng),Tira Retail
492494485,30100417, Rice & Ceramide Moisturizing Emulsion,Tira Retail
492495035,30100150, Real Nature Potato Face Mask(20gm)(Potato),Tira Retail
492495048,30100015, Real Nature Rice Face Mask(20gm)(Rice),Tira Retail
492495019,30100458, Chia Seed Hydro Mist,Tira Retail
494342444,30100580, RICE WATER BRIGHT TRIAL KIT,Tira Retail
492657861,30100011, The Solution Pore Care Face Mask(20gm),Tira Retail
492495015,30100009, The Solution Nourishing Face Mask(20gm),Tira Retail
492495014,30100008, The Solution Firming Face Mask(20gm),Tira Retail
492495012,30100479, Mango Seed Moisturizing Toner,Tira Retail
492495011,30100013, Real Nature Cucumber Face Mask(20gm)(Cucumber),Tira Retail
492495010,30100111, Smart Peeling White Jewel Perle,Tira Retail
492495009,30100480, Mango Seed Moisturizing Lotion,Tira Retail
492495008,30100502, Energy Seed Antioxidant Hydro Serum,Tira Retail
492495007,30100482, Mango Seed Moisturizing Butter,Tira Retail
494342445,30100577,THE THERAPY VEGAN TRIAL KIT,Tira Retail
492494524,30100112, Smart Peeling Honey Black Sugar Scrub,Tira Retail
492493941,30100472, Water Fit Lip Tint - Picnic Red,Tira Retail
492493947,30100471, Water Fit Lip Tint - Pink Mate,Tira Retail
492494515,30100474, Water Fit Lip Tint - Cherry Kiss,Tira Retail
492493954,30100348, Rice Water Bright Rice Bran Cleansing Foam,Tira Retail
492493950,30100425, Intense Hydrating MasCream Sheet(30gm),Tira Retail
492493949,30100424, Intense Elasticity MasCream Sheet(30gm),Tira Retail
492493948,30100423, Mascream Intense Sheet - Moisturizing(20gm),Tira Retail
492493946,30100450, Green Natural Seed Antioxidant Cream,Tira Retail
492493945,30100449, Green Natural Seed Antioxidant Serum,Tira Retail
492493942,30100428, Mask.Lab Brightening Lift Up Face Mask(25ml),Tira Retail
494342447,30100584,Air Cotton Cushion SPF50+ PA++++ (203 Beige),Tira Retail
492493937,30100477, Lip Care Cream - Shea Butter,Tira Retail
492874403,30100544,Jeju Volcanic Lava Fresh Nose Strips,Tira Retail
492495042,30100012, Real Nature Aloe Face Mask(20gm)(Aloe),Tira Retail
494261794,30100367,Rice Water Bright Foaming Cleanser 50ml,Tira Retail
493913591,60100001, The True Cream Aqua Bomb 10Ml,Tira Retail
493913593,60100002, The True Cream Moisturizing Bomb 10Ml,Tira Retail
493913596,60100069, UV protector multi sun screen 3ml,Tira Retail
493621971,30100109,THE FACE SHOP FRSHJEJUALOREFRICEGL300 ml,Tira Retail
493622920,30100472,THE FACE SHOP WATER INT  PICNIC RED 5 gm,Tira Retail
493622921,30100471,THE FACE SHOP WATER TINT  PINK MATE 5 gm,Tira Retail
493622922,30100474,THE FACE SHOP WATER NT  CHERRY KISS 5 gm,Tira Retail
493622978,30100250,THE FACE SHOP JEJU VNG FOAM SCRUB 150 ml,Tira Retail
493622979,30100251,THE FACE SHOP JEJU VLEANSING FOAM 140 ml,Tira Retail
494412108,30100597,TheFaceShop Vitamin C Lip Sleeping Mask,Tira Retail
494412715,60100087,Belif Superknights MultiVitaminMask 75ml,Tira Retail
494412716,60100088,Belif Superknights regeneratingMask 75ml,Tira Retail
494412717,60100085,belif MultiVit Lipcerin mask balm scrub,Tira Retail
494412106,30100595,TheFaceShop Rice Water Cream NIACNMD HA,Tira Retail
494412107,30100593,TheFaceShop VTMNC BRTNG SRM NC AMN ACD,Tira Retail
494412719,60100080,Belif UVProtector AquaBomb SunSerum 50ml,Tira Retail
494432065,30100598,TheFaceShop LPCRN LipMSK BalmSCRB DSPNSR,Tira Retail
494412105,30100594,TheFaceShop RcWTR SRM NIACNMD HA,Tira Retail
494446804,60100087,GWPBelifSuperknightsmultivitaminmask 3ml,Tira Retail
494342594,30100581,GWP The Face Shop Tea Tree PA 10ml,Tira Retail
494446803,60100086,GWPBelifSuperknightsclearsoothingmask3ml,Tira Retail
494412104,30100596,TheFaceShop RC WTR EyeCRM  NIACNMD,Tira Retail
551027,30100105, Jeju Aloe Fresh Soothing Gel,H & G
571506,30100543,Jeju Aloe Fresh Soothing Foam Cleanser,H & G
551022,30100003, Rice Water Bright Foaming Cleanser,H & G
571507,30100554,Rice Water Bright Foaming Cleanser 100Ml,H & G
551035,30100012,THE FACE SHOP REAL NATURE ALOE SHEETMASK,H & G
551037,30100014,THE FACE SHOP REAL NATUR LEMON SHEETMASK,H & G
551038,30100015,THE FACE SHOP REAL NATURE RICE SHEETMASK,H & G
551044,30100021,THE FAE SHOP REAL NAT POMEGRNT SHEETMASK,H & G
2000000735,30100015, Real Nature Rice Face Mask(20gm)(Rice),Boddess
2000000741,30100021, Real Nature Pomegranate Face Mask(20gm)(Pomegranate),Boddess
2000000822,30100410, Pomegranate And Collagen Volume Lifting Toner,Boddess
2000000828,30100416, Rice & Ceramide Moisturizing Toner,Boddess
2000000843,30100438,White Seed Brightening Toner,Boddess
2000000873,30100435, Rice & Ceramide Moisturizing Cream,Boddess
2000003648,30100417, Rice & Ceramide Moisturizing Emulsion,Boddess
3000633002,30100471, Water Fit Lip Tint - Pink Mate,Boddess
2000000853,30100459, Chia Seed Hydro Cream,Boddess
2000000734,30100014, Real Nature Lemon Face Mask(20gm)(Lemon),Boddess
2000000738,30100018, Real Nature Honey Miel Face Mask(20gm)(Honey),Boddess
2000000791,30100150, Real Nature Potato Face Mask(20gm)(Potato),Boddess
2000000823,30100411, Pomegranate And Collagen Volume Lifting Emulsion,Boddess
2000000824,30100412, Pomegranate And Collagen Volume Lifting Serum,Boddess
2000000844,30100439, White Seed Brightening Lotion,Boddess
2000000850,30100456, Chia Seed Hydro Toner,Boddess
2000000851,30100457, Chia Seed Vit B12 Hydro Lotion,Boddess
2000004261,30100528, Naturalsun Eco No Shine Hydrating Sun Cream,Boddess
2000004920,30100543,Jeju Aloe Fresh Soothing Foam Cleanser,Boddess
2000000809,30100250, Jeju Volcanic Lava Scrub Foam,Boddess
2000000749,30100035, White Seed Brightening Serum,Boddess
2000000813,30100351, Rice Water Bright Light Cleansing Oil,Boddess
2000000814,30100352,Rice Water Bright Rich Cleansing Oil,Boddess
2000000825,30100413, Pomegranate And Collagen Volume Lifting Cream,Boddess
3000291006,30100470, Water Fit Lip Tint - Rose Pink,Boddess
3000633005,30100474, Water Fit Lip Tint - Cherry Kiss,Boddess
2000000826,30100414, Pomegranate And Collagen Volume Lifting Eye Cream,Boddess
3000633003,30100472, Water Fit Lip Tint - Picnic Red,Boddess
2000004120,30100251, Jeju Volcanic Lava Cleansing Foam,Boddess
